word,len
m i0 j ɛ0 n,5
m i0 j ɛ0 t,5
m i0 j ɛ0 d t,6
m i0 eː0 r t,5
m i0 eː0 n k,5
m i0 ɑ0 tː,4
m i0 v ɛ0 l,5
m i0 k o0 r,5
m i0 k eː0 n t,6
m i0 k eː0 pː,5
m i0 k ɛ0 r,5
m i0 k ɛ0 r t,6
m i0 k ɛ0 t,5
m i0 n t h ɑ0,6
m i0 n t h o0 ɟ,7
m i0 n t ɛ0,5
m i0 n t ɛ0 ɟ,6
m i0 n t ɛ0 n t,7
m i0 n t ɛ0 n,6
m i0 n t ɛ0 tː,6
m i0 n t ɛ0 t,6
m i0 n t eː0 n,6
m i0 n t j eː0 n,7
m i0 n t j eː0 t,7
m i0 n t j ɛ0,6
m i0 n t yː0,5
m i0 n t ʃ ɛ0 m,7
m i0 n t r ɛ0,6
m i0 n t ɑ0,5
m i0 n t i0 m,6
m i0 n t aː0 t,6
m i0 n t øː0,5
m i0 n d ɛ0 n t,7
m i0 n d ɛ0 z,6
m i0 n d ɛ0 z t,7
m i0 n d ɛ0 ɟ,6
m i0 n d ɛ0 t,6
m i0 n d u0 l t,7
m i0 n d u0 l,6
m i0 n d u0,5
m i0 n d k eː0 t,7
m i0 n d j aː0 r t,8
m i0 n d ɑ0 z t,7
m i0 n d ɑ0 z,6
m i0 n d iː0 t,6
m i0 n d o0 k,6
m i0 n k aː0 bː,6
m i0 n k ɛ0 t,6
m i0 n k ɛ0 k,6
m i0 n k ɛ0 n,6
m i0 n k ɛ0 l t,7
m i0 n k r ɛ0,6
m i0 n eː0 l,5
m i0 n ɛ0 k,5
m i0 n i0,4
m i0 n ɑ0 t,5
m i0 n ɑ0 p,5
m i0 n ɑ0 ʃ,5
m i0 r ɛ0,4
m i0 r ɛ0 k t,6
m i0 r øː0 l,5
m i0 d øː0,4
m i0 d øː0 t,5
m i0 d øː0 k,5
m i0 d øː0 n,5
m i0 d øː0 n k,6
m i0 d øː0 m,5
m i0 d øː0 ʃ,5
m i0 h ɛ0 j t,6
m i0 h ɛ0 z,5
m i0 h ɛ0 n t,6
m i0 t øː0 l,5
m i0 b øː0 l,5
m i0 b ɛ0 n,5
m i0 ʃ ɛ0 bː,5
m i0 ʃ ɛ0 l t,6
m i0 ʃ ɛ0 l,5
m i0 ʃ ɛ0,4
m o0 n d t ɑ0,6
m o0 n d t ɑ0 m,7
m o0 n d t ɑ0 d,7
m o0 n d t ɑ0 k,7
m o0 n d t aː0 k,7
m o0 n d t aː0 l,7
m o0 n d t u0 k,7
m o0 n d j ɑ0,6
m o0 n d j ɑ0 m,7
m o0 n d j ɑ0 k,7
m o0 n d j u0 k,7
m o0 n d j u0 n k,8
m o0 n d j aː0 k,7
m o0 n d j o0 n,7
m o0 n d o0 m,6
m o0 n d o0 tː,6
m o0 n d o0 l,6
m o0 n d o0 l t,7
m o0 n d o0 l s,7
m o0 n d o0 l j,7
m o0 n d o0 l d,7
m o0 n d o0 k,6
m o0 n d o0 t,6
m o0 n d o0 d,6
m o0 n d o0 ʃ,6
m o0 n d ɑ0 t,6
m o0 n d ɑ0,5
m o0 n d ɑ0 s,6
m o0 n d v ɑ0,6
m o0 n d v aː0 n,7
m o0 n d aː0 ʃ,6
m o0 n d u0 n k,7
m o0 n d h ɑ0 t,7
m o0 d ɛ0 r n,6
m o0 d ɛ0 lː,5
m o0 d ɛ0 lː t,6
m o0 b i0 l,5
m o0 t o0 r,5
m o0 z g aː0 ʃ,6
m o0 z g aː0 ʃ t,7
m o0 z g oː0,5
m o0 z g o0 tː,6
m o0 z o0 tː,5
m o0 z o0 g,5
m o0 z o0 m,5
m o0 z i0,4
m o0 z d u0 l t,7
m o0 z d u0 l,6
m o0 z d u0 l j,7
m o0 l n ɑ0 p,6
m o0 l n aː0 r,6
m o0 l n eː0 k,6
m o0 tʃ k o0 ʃ,6
m o0 tʃ o0 k,5
m o0 ʃ o0 j,5
m o0 ʃ o0 tː,5
m o0 ʃ n i0,5
m o0 r aː0 n,5
m o0 r aː0 t,5
m o0 r aː0 l,5
m o0 r aː0 s,5
m o0 h oː0 ts,5
m o0 h oː0,4
m aː0 ʃ i0 k,5
m aː0 ʃ o0 k,5
m aː0 ʃ r eː0 s t,7
m aː0 ʃ r ɑ0,5
m aː0 ʃ r oː0 l,6
m aː0 ʃ n ɑ0 p,6
m aː0 ʃ n ɑ0 k,6
m aː0 ʃ f eː0 l,6
m aː0 ʃ h o0 l,6
m aː0 ʃ h o0 ɟ,6
m aː0 ʃ h o0 z,6
m aː0 ʃ k eː0 pː,6
m aː0 ʃ k eː0 n t,7
m aː0 ʃ k o0 r,6
m aː0 ʃ k ɑ0,5
m aː0 ʃ k aː0 t,6
m aː0 ʃ u0 tː,5
m aː0 ʃ b ɑ0 n,6
m aː0 ʃ m aː0 ʃ,6
m aː0 ʃ t oː0 l,6
m aː0 j u0 ʃ,5
m aː0 j u0 k,5
m aː0 r i0,4
m aː0 r i0 ʃ,5
m aː0 r ɑ0,4
m aː0 r ɑ0 z,5
m aː0 r ɑ0 k,5
m aː0 r ɑ0 d t,6
m aː0 r ɑ0 d,5
m aː0 r ɑ0 t,5
m aː0 r ɑ0 m,5
m aː0 r ɑ0 n,5
m aː0 r ɑ0 s t,6
m aː0 r m i0,5
m aː0 r m i0 t,6
m aː0 r m i0 n t,7
m aː0 r m i0 j,6
m aː0 r m ɛ0 j,6
m aː0 r m aː0 r,6
m aː0 r m ɑ0 n,6
m aː0 r m ɑ0 ʃ,6
m aː0 r m ɑ0 t,6
m aː0 r m yː0,5
m aː0 r k i0,5
m aː0 r k i0 t,6
m aː0 r k ɑ0,5
m aː0 r k aː0 ɲ,6
m aː0 r k aː0 t,6
m aː0 r t ɑ0 m,6
m aː0 r t ɑ0,5
m aː0 r t ɑ0 k,6
m aː0 r t o0 k,6
m aː0 r t o0 tː,6
m aː0 r t o0 t,6
m aː0 r t u0 n k,7
m aː0 r t u0 k,6
m aː0 r t aː0 k,6
m aː0 r t aː0 ʃ,6
m aː0 r t aː0 l,6
m aː0 r t oː0,5
m aː0 r t oː0 k,6
m aː0 r t j ɑ0,6
m aː0 r t n ɑ0 k,7
m aː0 r t n aː0,6
m aː0 r t n aː0 l,7
m aː0 ʃː ɑ0 l,5
m aː0 ʃː ɑ0,4
m aː0 ʃː ɑ0 m,5
m aː0 i0 g,4
m aː0 t oː0,4
m aː0 t oː0 l,5
m aː0 s n i0,5
m ɑ0 g ɑ0,4
m ɑ0 g ɑ0 m,5
m ɑ0 g ɑ0 ʃ,5
m ɑ0 g ɑ0 ʃ d,6
m ɑ0 g ɑ0 d,5
m ɑ0 g ɑ0 d t,6
m ɑ0 g aː0 t,5
m ɑ0 g aː0 n,5
m ɑ0 g aː0 ɲ,5
m ɑ0 g u0 k,5
m ɑ0 g u0 n k,6
m ɑ0 g j ɑ0,5
m ɑ0 g o0 k,5
m ɑ0 g o0 t,5
m ɑ0 g o0 j,5
m ɑ0 g z ɑ0 t,6
m ɑ0 i0,3
m ɑ0 r ɑ0 d t,6
m ɑ0 r ɑ0 d,5
m ɑ0 r ɑ0 d s,6
m ɑ0 r ɑ0 d j,6
m ɑ0 r ɑ0 b,5
m ɑ0 r ɑ0 ɲ,5
m ɑ0 r ɑ0 n,5
m ɑ0 r ɑ0 n tʃ,6
m ɑ0 r ɑ0 s t,6
m ɑ0 r ɑ0 ts k,6
m ɑ0 r ɑ0 g,5
m ɑ0 r ɑ0 t,5
m ɑ0 r h ɑ0,5
m ɑ0 r eː0 k,5
m ɑ0 j d n ɛ0 m,7
m ɑ0 j d ɑ0 n,6
m ɑ0 j o0 n,5
m ɑ0 j o0 m,5
m ɑ0 j o0 k,5
m ɑ0 j o0 l t,6
m ɑ0 j o0 ʃ,5
m ɑ0 j ɑ0,4
m ɑ0 j ɑ0 t,5
m ɑ0 d aː0 ʃ,5
m ɑ0 d aː0 r,5
m ɑ0 d aː0 s,5
m ɑ0 tʃ k ɑ0,5
m ɑ0 tʃ k aː0 k,6
m ɑ0 tʃ k aː0 t,6
m ɑ0 tʃ k oː0,5
m ɑ0 m ɑ0 r,5
m ɑ0 m ɑ0,4
m ɑ0 m ɑ0 z,5
m ɑ0 m ɑ0 t,5
m ɑ0 k ɑ0 r,5
m ɑ0 k ɑ0 r t,6
m ɑ0 k ɑ0 r s,6
m ɑ0 k ɑ0 t,5
m ɑ0 k ɑ0 d,5
m ɑ0 k ɑ0 d t,6
m ɑ0 k ɑ0 s,5
m ɑ0 k ɑ0 s t,6
m ɑ0 k ɑ0,4
m ɑ0 k ɑ0 tʃ,5
m ɑ0 ɟ ɑ0 m,5
m ɑ0 ɟ ɑ0 r t,6
m ɑ0 ɟ ɑ0,4
m ɑ0 t r oː0 z,6
m ɑ0 t ɛ0 k,5
m ɑ0 sː aː0 ʒ,5
m ɑ0 sː iː0 v,5
m eː0 g i0 ʃ,5
m eː0 g i0,4
m eː0 g i0 g,5
m eː0 g ʃ ɛ0 m,6
m eː0 g ʃ ɛ0,5
m eː0 g ʃ øː0,5
m eː0 l t oː0,5
m eː0 l t ɛ0 k,6
m eː0 l t ɛ0 m,6
m eː0 l t ɛ0,5
m eː0 l t aː0 n,6
m eː0 l t y0 n k,7
m eː0 j ɛ0 n,5
m eː0 j ɛ0 bː,5
m eː0 j eː0 n,5
m eː0 j r ɛ0,5
m eː0 j ʃ eː0 g,6
m eː0 j b ɛ0,5
m eː0 t ɛ0 n,5
m eː0 t ɛ0 l,5
m eː0 t ɛ0 l t,6
m eː0 t ɛ0 r,5
m eː0 t ɛ0 r t,6
m eː0 t ɛ0,4
m eː0 t ɛ0 g,5
m eː0 t ɛ0 ʃ,5
m eː0 t ɛ0 j,5
m eː0 t ɛ0 t,5
m eː0 r ɛ0 m,5
m eː0 r ɛ0 n,5
m eː0 r ɛ0 k,5
m eː0 r ɛ0 ʃ,5
m eː0 r ɛ0 z,5
m eː0 r ɛ0 tː,5
m eː0 r ɛ0 g,5
m eː0 r ɛ0 t,5
m eː0 r ɛ0,4
m eː0 r ɛ0 l t,6
m eː0 r g ɛ0 ʃ,6
m eː0 r g ɛ0 t,6
m eː0 r n i0,5
m eː0 r n ɛ0 k,6
m eː0 r n ɛ0,5
m eː0 r n ø0 k,6
m eː0 r l ɛ0 k,6
m eː0 r l ɛ0 g,6
m eː0 r t ɛ0 m,6
m eː0 r t ɛ0,5
m eː0 r t ɛ0 k,6
m eː0 r t ɛ0 d,6
m eː0 r t ɛ0 tː,6
m eː0 r t ɛ0 s,6
m eː0 r t eː0 k,6
m eː0 r t i0,5
m eː0 r t i0 k,6
m eː0 r t y0 n k,7
m eː0 r t y0 k,6
m eː0 r t j y0 k,7
m eː0 r t øː0,5
m eː0 r t ʃ ɛ0,6
m eː0 r eː0 ʃ,5
m eː0 r eː0 ʃ t,6
m eː0 r eː0 t,5
m eː0 r f i0,5
m eː0 r f i0 t,6
m eː0 r f ø0 l d,7
m eː0 z ɛ0 tː,5
m eː0 z ɛ0 m,5
m eː0 z ɛ0 k,5
m eː0 z ɛ0 t,5
m eː0 z ɛ0 l d,6
m eː0 z ɛ0 l,5
m eː0 z ɛ0 l t,6
m eː0 z ɛ0 n,5
m ɛ0 lː ɛ0 tː,5
m ɛ0 lː ɛ0 n,5
m ɛ0 lː ɛ0 n t,6
m ɛ0 lː ɛ0 m,5
m ɛ0 lː ɛ0 g,5
m ɛ0 lː ɛ0,4
m ɛ0 lː eː0,4
m ɛ0 lː eː0 m,5
m ɛ0 lː eː0 ɲ t,6
m ɛ0 lː eː0 n,5
m ɛ0 lː øː0,4
m ɛ0 lː øː0 ʃ,5
m ɛ0 lː øː0 l,5
m ɛ0 g i0 n t,6
m ɛ0 g v ɑ0 n,6
m ɛ0 g v o0 l t,7
m ɛ0 g h ɑ0 l t,7
m ɛ0 g h ɑ0 l,6
m ɛ0 g h i0 tː,6
m ɛ0 g s ɛ0 bː,6
m ɛ0 g s yː0 n t,7
m ɛ0 g aː0 lː t,6
m ɛ0 g aː0 lː,5
m ɛ0 g iː0 t,5
m ɛ0 g iː0 t ʃ,6
m ɛ0 g iː0 r t,6
m ɛ0 g j o0 bː,6
m ɛ0 g j ø0 tː,6
m ɛ0 g j ø0 n,6
m ɛ0 g n ɑ0 p,6
m ɛ0 g n eː0 z,6
m ɛ0 g n øː0 tː,6
m ɛ0 g l ɛ0 p,6
m ɛ0 g l ɛ0 s,6
m ɛ0 g l ɛ0 s t,7
m ɛ0 g ɲ iː0 l t,7
m ɛ0 g ø0 l t,6
m ɛ0 g k eː0 r t,7
m ɛ0 g eː0 ɲ,5
m ɛ0 g eː0 ɲ t,6
m ɛ0 g eː0 r,5
m ɛ0 g eː0 r t,6
m ɛ0 g eː0 d,5
m ɛ0 g eː0 l t,6
m ɛ0 g t ø0 bː,6
m ɛ0 g t ø0 r t,7
m ɛ0 g t ɛ0 l t,7
m ɛ0 g t ɛ0 tː,6
m ɛ0 g t ɛ0 s,6
m ɛ0 j ɛ0 tː,5
m ɛ0 j ɛ0 k,5
m ɛ0 j ɛ0 n,5
m ɛ0 j ɛ0 t,5
m ɛ0 j ɛ0 ʃ,5
m ɛ0 j ɛ0,4
m ɛ0 j ɛ0 m,5
m ɛ0 j ɛ0 d,5
m ɛ0 j ɛ0 d t,6
m ɛ0 j i0 k,5
m ɛ0 j i0,4
m ɛ0 j n ɛ0 k,6
m ɛ0 j b ɛ0 n,6
m ɛ0 j b ɛ0,5
m ɛ0 j b øː0 l,6
m ɛ0 j r ɛ0,5
m ɛ0 j r øː0 l,6
m ɛ0 j h ɛ0 z,6
m ɛ0 l ɛ0,4
m ɛ0 l ɛ0 n t,6
m ɛ0 l ɛ0 n,5
m ɛ0 l ɛ0 m,5
m ɛ0 l ɛ0 g,5
m ɛ0 l ɛ0 tː,5
m ɛ0 l ɛ0 d,5
m ɛ0 l ɛ0 k,5
m ɛ0 l ɛ0 l,5
m ɛ0 l ɛ0 l t,6
m ɛ0 l ɛ0 t,5
m ɛ0 l ɛ0 dː,5
m ɛ0 l ɛ0 j t ʃ d,8
m ɛ0 l ɛ0 ʃ,5
m ɛ0 l ɛ0 p,5
m ɛ0 l oː0,4
m ɛ0 l oː0 t,5
m ɛ0 nː i0,4
m ɛ0 nː ɛ0,4
m ɛ0 nː ɛ0 k,5
m ɛ0 nː ɛ0 m,5
m ɛ0 nː ɛ0 d,5
m ɛ0 nː eː0 l,5
m ɛ0 nː eː0 k,5
m ɛ0 nː eː0 n k,6
m ɛ0 nː eː0,4
m ɛ0 nː eː0 m,5
m ɛ0 ɲː i0,4
m ɛ0 ɲː i0 t,5
m ɛ0 ɲː b ɛ0,5
m ɛ0 sː ɛ0,4
m ɛ0 sː ɛ0 r t,6
m ɛ0 sː ɛ0 bː,5
m ɛ0 sː i0,4
m ɛ0 ɟ ɛ0 n,5
m ɛ0 ɟ ɛ0 ʃ,5
m ɛ0 ɟ ɛ0 ɟ,5
m ɛ0 ɟ ɛ0 t,5
m ɛ0 ɟ ɛ0 k,5
m ɛ0 ɟ ɛ0,4
m ɛ0 ɟ ɛ0 d,5
m ɛ0 ɟ ɛ0 m,5
m ɛ0 ɟ y0 tː,5
m ɛ0 ɟ y0 n k,6
m ɛ0 ɟ y0 k,5
m ɛ0 ʃ t ɛ0,5
m ɛ0 ʃ t ɛ0 r,6
m ɛ0 ʃ t ɛ0 t,6
m ɛ0 ʃ t ɛ0 tː,6
m ɛ0 ʃ t ɛ0 m,6
m ɛ0 ʃ t ɛ0 k,6
m ɛ0 ʃ t ɛ0 d,6
m ɛ0 ʃ t i0,5
m ɛ0 ʃ t i0 g,6
m ɛ0 ʃ t øː0,5
m ɛ0 ʃ t v eː0 r,7
m ɛ0 ʃ t v ɛ0,6
m ɛ0 ʃ t v ɛ0 n ts,8
m ɛ0 ʃ t v ɛ0 n,7
m ɛ0 ʃ t eː0 t,6
m ɛ0 ʃ t eː0 n,6
m ɛ0 ʃ t eː0 k,6
m ɛ0 ʃ t eː0 ʃ,6
m ɛ0 ʃ t b ɛ0 n,7
m ɛ0 ʃ t b ɛ0,6
m ɛ0 ʃ t b øː0 l,7
m ɛ0 ʃ t m eː0 ɲ,7
m ɛ0 ʃ t m eː0 ɲ t,8
m ɛ0 ʃ t yː0,5
m ɛ0 ʃ t y0 k,6
m ɛ0 ʃ t y0 n k,7
m ɛ0 ʃ t n ɛ0 k,7
m ɛ0 ʃ ɛ0 tː,5
m ɛ0 ʃ ɛ0 t,5
m ɛ0 ʃ ɛ0,4
m ɛ0 ʃ ɛ0 m,5
m ɛ0 ʃ eː0 j,5
m ɛ0 ʃ eː0 j t,6
m ɛ0 ʃ eː0 l t,6
m ɛ0 ʃ eː0 l,5
m ɛ0 ʃ eː0 k,5
m ɛ0 ʃ eː0 t,5
m ɛ0 ʃ eː0 ʃ,5
m ɛ0 n j ɛ0 n,6
m ɛ0 n j ɛ0 k,6
m ɛ0 n j y0 n k,7
m ɛ0 n t i0,5
m ɛ0 n t i0 ʃ,6
m ɛ0 n t ɛ0 m,6
m ɛ0 n t ɛ0 k,6
m ɛ0 n t ɛ0 ʃ,6
m ɛ0 n t ɛ0 bː,6
m ɛ0 n t eː0 n,6
m ɛ0 n t y0 n k,7
m ɛ0 n t r u0 m,7
m ɛ0 n t ʃ eː0 g,7
m ɛ0 n t øː0 k,6
m ɛ0 n ɛ0,4
m ɛ0 n ɛ0 t,5
m ɛ0 n øː0,4
m ɛ0 n y0,4
m ɛ0 r y0 l t,6
m ɛ0 r y0 l,5
m ɛ0 r y0 n k,6
m ɛ0 r t ɛ0,5
m ɛ0 r t ɛ0 ʃ,6
m ɛ0 r t ɛ0 m,6
m ɛ0 r t ɛ0 k,6
m ɛ0 r t ɛ0 t,6
m ɛ0 r t b ɛ0 n,7
m ɛ0 r t b ɛ0,6
m ɛ0 r t b øː0 l,7
m ɛ0 r t h o0 ɟ,7
m ɛ0 r t i0,5
m ɛ0 r t eː0 s,6
m ɛ0 r t j ɛ0,6
m ɛ0 r t øː0 z,6
m ɛ0 r ɛ0 k,5
m ɛ0 r ɛ0 t,5
m ɛ0 r ɛ0 t s,6
m ɛ0 r ɛ0 ʃ,5
m ɛ0 r ɛ0,4
m ɛ0 r ɛ0 m,5
m ɛ0 r ɛ0 m t,6
m ɛ0 r ɛ0 d,5
m ɛ0 r ɛ0 d t,6
m ɛ0 r ɛ0 p,5
m ɛ0 r ɛ0 v,5
m ɛ0 r ɛ0 z,5
m ɛ0 r ɛ0 z d,6
m ɛ0 r ɛ0 s t,6
m ɛ0 r ɛ0 l t,6
m ɛ0 r ɛ0 g,5
m ɛ0 r ɛ0 ʃː,5
m ɛ0 r eː0 n,5
m ɛ0 r eː0 k,5
m ɛ0 r eː0 ɲ,5
m ɛ0 r eː0 s t,6
m ɛ0 r eː0 s,5
m ɛ0 r øː0 ʃ,5
m ɛ0 r øː0,4
m ɛ0 r øː0 t,5
m ɛ0 r øː0 k,5
m ɛ0 r øː0 m,5
m ɛ0 r øː0 d,5
m ɛ0 r i0,4
m ɛ0 r i0 n g,6
m ɛ0 r i0 n ts,6
m ɛ0 r n i0,5
m ɛ0 r n ɛ0 l,6
m ɛ0 r n ɛ0 k,6
m ɛ0 r n eː0 k,6
m ɛ0 h ɛ0 t,5
m ɛ0 h ɛ0 t s,6
m ɛ0 h ɛ0 r,5
m ɛ0 jː ɛ0 l,5
m ɛ0 rː ɛ0,4
m ɛ0 t r oː0,5
m ɛ0 dː i0 g,5
m ɛ0 dː i0,4
m ɛ0 dː øː0,4
m ɛ0 d v ɛ0 ʃ,6
m ɛ0 d v ɛ0 ʃ t,7
m ɛ0 d v ɛ0 n ts,7
m ɛ0 d v ɛ0 n,6
m ɛ0 d v ɛ0,5
m ɛ0 d v ɛ0 m,6
m ɛ0 d v ɛ0 l t,7
m ɛ0 d v ɛ0 l,6
m ɛ0 d v ɛ0 t,6
m ɛ0 d v ɛ0 d,6
m ɛ0 d v ɛ0 z,6
m ɛ0 d v yː0,5
m ɛ0 z øː0,4
m ɛ0 z øː0 n,5
m ɛ0 z øː0 ɲ,5
m ɛ0 tʃː ɛ0 n,5
m ɛ0 tʃː ɛ0 t,5
m oː0 d o0 n,5
m oː0 d o0 t,5
m oː0 d o0 k,5
m oː0 d j ɑ0,5
m oː0 d j aː0 t,6
m oː0 d j aː0 n,6
m oː0 d s ɛ0 r,6
m oː0 d s ɛ0 r t,7
m oː0 d r ɑ0,5
m oː0 d b ɑ0 n,6
m oː0 k u0 ʃ,5
m oː0 k aː0 ʃ,5
m u0 n k ɑ0,5
m u0 n k aː0 t,6
m u0 n k aː0 k,6
m u0 n k aː0 ʃ,6
m u0 n k aː0 m,6
m u0 n k oː0,5
m u0 t ɑ0 t,5
m u0 t ɑ0 l,5
m u0 t ɑ0 l t,6
m u0 t ɑ0 k,5
m u0 t ɑ0 ʃ,5
m u0 t ɑ0 ʃ d,6
m u0 t ɑ0,4
m u0 t ɑ0 m,5
m u0 s aː0 j,5
m u0 l t i0 k,6
m u0 l t aː0 n,6
m uː0 l v ɑ0,5
m uː0 l i0 k,5
m uː0 l i0,4
m uː0 l t k o0 r,7
m uː0 l t b ɑ0 n,7
m uː0 l t b oː0 l,7
m uː0 l t ɑ0 t,6
m uː0 l t ɑ0 k,6
m uː0 l t j ɑ0,6
m uː0 l t r ɑ0,6
m uː0 l t aː0 n,6
m uː0 l oː0,4
m ø0 g ø0 tː,5
m ø0 g eː0,4
m ø0 g y0 l,5
m yː0 v eː0 s,5
m yː0 v eː0 s t,6
m yː0 v eː0 t,5
m yː0 v ɛ0,4
m yː0 v ɛ0 l t,6
m yː0 v ɛ0 l,5
m yː0 v ɛ0 k,5
m yː0 v ɛ0 t,5
m yː0 ʃ o0 r,5
m yː0 ʃ o0 r t,6
m yː0 f ɑ0 j,5
m yː0 h ɛ0 j,5
m yː0 b ɛ0 n,5
m iː0 n u0 s,5
m iː0 t o0 s,5
m iː0 g n ɛ0 m,6
ɛ0 z eː0 r t,5
ɛ0 z eː0 r,4
ɛ0 z eː0 t,4
ɛ0 z eː0 n,4
ɛ0 z ɛ0 k,4
ɛ0 z ɛ0 n,4
ɛ0 z ɛ0 r,4
ɛ0 z ɛ0 r t,5
ɛ0 z ɛ0 t,4
ɛ0 z ɛ0,3
ɛ0 z ɛ0 m,4
ɛ0 z ɛ0 l t,5
ɛ0 z ɛ0 d,4
ɛ0 z ɛ0 ʃː,4
ɛ0 z y0 ʃ t,5
ɛ0 z r ɛ0 ʃ,5
ɛ0 z r ɛ0 n,5
ɛ0 z r ɛ0 t,5
ɛ0 z r ɛ0 t s,6
ɛ0 z r ɛ0 d,5
ɛ0 z r ɛ0 d t,6
ɛ0 l øː0 tː,4
ɛ0 l øː0,3
ɛ0 l øː0 bː,4
ɛ0 l øː0 l,4
ɛ0 l øː0 ɲ t,5
ɛ0 l eː0 g,4
ɛ0 l eː0,3
ɛ0 l eː0 t,4
ɛ0 l eː0 m,4
ɛ0 l eː0 r t,5
ɛ0 l eː0 n k,5
ɛ0 l eː0 n,4
ɛ0 l eː0 p,4
ɛ0 l m uː0 l t,6
ɛ0 l m ɛ0,4
ɛ0 l m ɛ0 n t,6
ɛ0 l m ɛ0 n ʃ,6
ɛ0 l m ɛ0 ɟ,5
ɛ0 l m ɛ0 z,5
ɛ0 l m ɛ0 z t,6
ɛ0 l m eː0 t,5
ɛ0 l n ø0 k,5
ɛ0 l n øː0 tː,5
ɛ0 l n i0,4
ɛ0 l n ɛ0 k,5
ɛ0 l t yː0 n t,6
ɛ0 l t ɛ0 tː,5
ɛ0 l t ɛ0 l t,6
ɛ0 l t ɛ0 m,5
ɛ0 l t eː0 r,5
ɛ0 l t i0,4
ɛ0 l t øː0,4
ɛ0 l ɛ0,3
ɛ0 l ɛ0 n t,5
ɛ0 l ɛ0 n,4
ɛ0 l ɛ0 m,4
ɛ0 l ɛ0 g,4
ɛ0 l ɛ0 tː,4
ɛ0 l ɛ0 d,4
ɛ0 l ɛ0 k,4
ɛ0 l ɛ0 l,4
ɛ0 l ɛ0 l t,5
ɛ0 l ɛ0 t,4
ɛ0 l ɛ0 dː,4
ɛ0 l ɛ0 j t ʃ d,7
ɛ0 l ɛ0 ʃ,4
ɛ0 l ɛ0 p,4
ɛ0 l h u0 ɲ t,6
ɛ0 l h øː0,4
ɛ0 l h øː0 k,5
ɛ0 l h øː0 ʃ,5
ɛ0 l j ɛ0 ʃ,5
ɛ0 l j ɛ0 bː,5
ɛ0 l j ø0 tː,5
ɛ0 l j ø0 n,5
ɛ0 l j u0 t,5
ɛ0 l v ɛ0 n ts,6
ɛ0 l v ɛ0 n,5
ɛ0 l v ɛ0 t,5
ɛ0 l v ɛ0,4
ɛ0 l v ɛ0 k,5
ɛ0 l v ɛ0 tː,5
ɛ0 l v yː0,4
ɛ0 l v i0,4
ɛ0 l v o0 n t,6
ɛ0 l v eː0 t,5
ɛ0 l v eː0 n,5
ɛ0 l v t aː0 r ʃ,7
ɛ0 l v b ɛ0 n,6
ɛ0 l v b ɛ0,5
ɛ0 l v r ɛ0,5
ɛ0 l v aː0 r t,6
ɛ0 l v aː0 r,5
ɛ0 l v n ɛ0 k,6
ɛ0 l ø0 l t,5
ɛ0 l ø0 l,4
ɛ0 l i0,3
ɛ0 l i0 k,4
ɛ0 l i0 t,4
ɛ0 l k i0,4
ɛ0 l k ɛ0 ʃ,5
ɛ0 l k ɛ0,4
ɛ0 l k ɛ0 t,5
ɛ0 l k ɛ0 m,5
ɛ0 l k ɛ0 k,5
ɛ0 l k ɛ0 z d,6
ɛ0 l k ɛ0 n t,6
ɛ0 l k ɛ0 l t,6
ɛ0 l k eː0 s,5
ɛ0 l k eː0 t,5
ɛ0 l k y0 k,5
ɛ0 l k yː0,4
ɛ0 l ʃ øː0,4
ɛ0 l ʃ øː0 bː,5
ɛ0 l ʃ øː0 k,5
ɛ0 l ʃ øː0 t,5
ɛ0 l d øː0 l t,6
ɛ0 l f eː0 r,5
ɛ0 l f o0 ɟ,5
ɛ0 l s oː0,4
ɛ0 l s aː0 n t,6
ɛ0 l s iː0 n,5
ɛ0 l s iː0 n t,6
ɛ0 rː ɛ0,3
ɛ0 rː øː0 l,4
ɛ0 nː ɛ0,3
ɛ0 nː ɛ0 k,4
ɛ0 nː ɛ0 m,4
ɛ0 nː ɛ0 d,4
ɛ0 nː eː0 l,4
ɛ0 nː eː0 k,4
ɛ0 nː eː0 n k,5
ɛ0 nː eː0,3
ɛ0 nː eː0 m,4
ɛ0 nː i0,3
ɛ0 zː ɛ0 l,4
ɛ0 zː ɛ0 g,4
ɛ0 bː ɛ0 n,4
ɛ0 bː ɛ0,3
ɛ0 bː øː0 l,4
ɛ0 ɟ y0 tː,4
ɛ0 ɟ y0 n k,5
ɛ0 ɟ y0 k,4
ɛ0 ɟ s ɛ0 r,5
ɛ0 ɟ s ɛ0 r t,6
ɛ0 ɟ r ɛ0,4
ɛ0 ɟ r eː0 s t,6
ɛ0 ɟ r eː0 s,5
ɛ0 ɟ ɛ0 n,4
ɛ0 ɟ ɛ0 ʃ,4
ɛ0 ɟ ɛ0 ɟ,4
ɛ0 ɟ ɛ0 t,4
ɛ0 ɟ ɛ0 k,4
ɛ0 ɟ ɛ0,3
ɛ0 ɟ ɛ0 d,4
ɛ0 ɟ ɛ0 m,4
ɛ0 ɟ eː0 b,4
ɛ0 ɟ eː0 n,4
ɛ0 ɟ eː0 n t,5
ɛ0 ɟ eː0 l,4
ɛ0 ɟ eː0 k,4
ɛ0 ɟ m aː0 ʃ t,6
ɛ0 ɟ m aː0 ʃ,5
ɛ0 ɟ h aː0 z,5
ɛ0 ɟ ʃ eː0 g,5
ɛ0 ɟ b ɛ0 n,5
ɛ0 ɟ b ɛ0,4
ɛ0 ɟ b øː0 l,5
ɛ0 ɟ k o0 r,5
ɛ0 ɟ t øː0 l,5
ɛ0 ɟ i0,3
ɛ0 ɟ i0 g,4
ɛ0 lː ɛ0 tː,4
ɛ0 lː ɛ0 n,4
ɛ0 lː ɛ0 n t,5
ɛ0 lː ɛ0 m,4
ɛ0 lː ɛ0 g,4
ɛ0 lː ɛ0,3
ɛ0 dː i0 g,4
ɛ0 dː i0,3
ɛ0 n g ɛ0 m,5
ɛ0 n g ɛ0 r,5
ɛ0 n g ɛ0 r t,6
ɛ0 n g ɛ0,4
ɛ0 n g ɛ0 d,5
ɛ0 n g ɛ0 dː,5
ɛ0 n g eː0 bː,5
ɛ0 n g eː0 d,5
ɛ0 n g eː0 k,5
ɛ0 n g eː0 n,5
ɛ0 n g øː0,4
ɛ0 ʃ t ɛ0,4
ɛ0 ʃ t ɛ0 r,5
ɛ0 ʃ t ɛ0 t,5
ɛ0 ʃ t ɛ0 tː,5
ɛ0 ʃ t ɛ0 m,5
ɛ0 ʃ t ɛ0 k,5
ɛ0 ʃ t ɛ0 d,5
ɛ0 ʃ t i0,4
ɛ0 ʃ t i0 g,5
ɛ0 ʃ t øː0,4
ɛ0 ʃ t v eː0 r,6
ɛ0 ʃ t v ɛ0,5
ɛ0 ʃ t v ɛ0 n ts,7
ɛ0 ʃ t v ɛ0 n,6
ɛ0 ʃ t eː0 t,5
ɛ0 ʃ t eː0 n,5
ɛ0 ʃ t eː0 k,5
ɛ0 ʃ t eː0 ʃ,5
ɛ0 ʃ t b ɛ0 n,6
ɛ0 ʃ t b ɛ0,5
ɛ0 ʃ t b øː0 l,6
ɛ0 ʃ t m eː0 ɲ,6
ɛ0 ʃ t m eː0 ɲ t,7
ɛ0 ʃ t yː0,4
ɛ0 ʃ t y0 k,5
ɛ0 ʃ t y0 n k,6
ɛ0 ʃ t n ɛ0 k,6
ɛ0 ʃ ɛ0 tː,4
ɛ0 ʃ ɛ0 t,4
ɛ0 ʃ ɛ0,3
ɛ0 ʃ ɛ0 m,4
ɛ0 ʃ i0 k,4
ɛ0 ʃ i0 g n,5
ɛ0 ʃ øː0,3
ɛ0 ʃ øː0 ʃ,4
ɛ0 ʃ øː0 t,4
ɛ0 ʃ eː0 j,4
ɛ0 ʃ eː0 j t,5
ɛ0 ʃ eː0 l t,5
ɛ0 ʃ eː0 l,4
ɛ0 ʃ eː0 k,4
ɛ0 ʃ eː0 t,4
ɛ0 ʃ eː0 ʃ,4
ɛ0 ʃ n ɛ0 k,5
ɛ0 ʃ n i0,4
ɛ0 ʃ k ɛ0 ɲ,5
ɛ0 ʃ k y0 t,5
ɛ0 ʃ h ɛ0 t,5
ɛ0 ʃ h ɛ0 t s,6
ɛ0 h h ɛ0 z,5
ɛ0 m b ɛ0 n,5
ɛ0 m b ɛ0 r t,6
ɛ0 m b ɛ0,4
ɛ0 m ɛ0,3
ɛ0 m ɛ0 k,4
ɛ0 m ɛ0 ʃ,4
ɛ0 m ɛ0 m,4
ɛ0 m ɛ0 t,4
ɛ0 m ɛ0 l t,5
ɛ0 m ɛ0 l,4
ɛ0 m ɛ0 n t,5
ɛ0 m ɛ0 n ʃ,5
ɛ0 m ɛ0 z,4
ɛ0 m ɛ0 z t,5
ɛ0 m ɛ0 d,4
ɛ0 m ɛ0 ɟ,4
ɛ0 m l eː0 k,5
ɛ0 m l iː0 t,5
ɛ0 r øː0 ʃ,4
ɛ0 r øː0,3
ɛ0 r øː0 t,4
ɛ0 r øː0 k,4
ɛ0 r øː0 m,4
ɛ0 r øː0 d,4
ɛ0 r ɛ0 k,4
ɛ0 r ɛ0 t,4
ɛ0 r ɛ0 t s,5
ɛ0 r ɛ0 ʃ,4
ɛ0 r ɛ0,3
ɛ0 r ɛ0 m,4
ɛ0 r ɛ0 m t,5
ɛ0 r ɛ0 d,4
ɛ0 r ɛ0 d t,5
ɛ0 r ɛ0 p,4
ɛ0 r ɛ0 v,4
ɛ0 r ɛ0 z,4
ɛ0 r ɛ0 z d,5
ɛ0 r ɛ0 s t,5
ɛ0 r ɛ0 l t,5
ɛ0 r ɛ0 g,4
ɛ0 r ɛ0 ʃː,4
ɛ0 r d ɑ0,4
ɛ0 r d aː0 n,5
ɛ0 r d øː0,4
ɛ0 r d øː0 k,5
ɛ0 r d ɛ0,4
ɛ0 r eː0 n,4
ɛ0 r eː0 k,4
ɛ0 r eː0 ɲ,4
ɛ0 r eː0 s t,5
ɛ0 r eː0 s,4
ɛ0 r g o0,4
ɛ0 r k ø0 l tʃ,6
ɛ0 r s ɛ0,4
ɛ0 r s aː0 m,5
ɛ0 r s eː0 ɲ,5
ɛ0 kː o0 r,4
ɛ0 tː øː0 l,4
ɛ0 tː øː0,3
ɛ0 tː øː0 ʃ,4
ɛ0 tː øː0 t,4
ɛ0 tː øː0 n k,5
ɛ0 tː ɛ0,3
ɛ0 tː ɛ0 m,4
ɛ0 tː ɛ0 k,4
ɛ0 tː ɛ0 n,4
ɛ0 tː ɛ0 l,4
ɛ0 tː ɛ0 t,4
ɛ0 tː ɛ0 d,4
ɛ0 tː ɛ0 ʃ,4
ɛ0 tː y0 k,4
ɛ0 tː y0 n k,5
ɛ0 ɲː i0,3
ɛ0 ɲː i0 t,4
ɛ0 s k ø0 z,5
ɛ0 s k ø0 z t,6
ɛ0 s k ɑ0,4
ɛ0 s i0,3
ɛ0 s i0 k,4
ɛ0 s ɛ0 k,4
ɛ0 s ɛ0 m,4
ɛ0 s ɛ0 l,4
ɛ0 s ɛ0 l t,5
ɛ0 s ɛ0 d,4
ɛ0 s ɛ0 tː,4
ɛ0 s ɛ0,3
ɛ0 s m eː0 k,5
ɛ0 s m ɛ0,4
ɛ0 s y0 n k,5
ɛ0 s y0 l t,5
ɛ0 s y0 l,4
ɛ0 s n ɛ0 k,5
ɛ0 ɲ eː0 r,4
ɛ0 ɲ eː0 m,4
ɛ0 ɲ h eː0 n,5
ɛ0 ɲ h ɛ0,4
ɛ0 b eː0 d,4
ɛ0 g ɛ0 d,4
ɛ0 g ɛ0 t,4
ɛ0 g ɛ0 ʃ,4
ɛ0 g ɛ0 k,4
ɛ0 g eː0 ɲ,4
ɛ0 g eː0 ɲ t,5
ɛ0 g eː0 r,4
ɛ0 g eː0 r t,5
ɛ0 g eː0 d,4
ɛ0 g eː0 l t,5
ɛ0 g r i0,4
ɛ0 v ɛ0,3
ɛ0 v ɛ0 t,4
ɛ0 v ɛ0 ʃ,4
ɛ0 v ɛ0 ʃ t,5
ɛ0 v ɛ0 l t,5
ɛ0 v ɛ0 l,4
ɛ0 v ɛ0 z,4
ɛ0 v ɛ0 tː,4
ɛ0 v ɛ0 k,4
ɛ0 v ɛ0 d,4
ɛ0 v ɛ0 r,4
ɛ0 v ɛ0 r t,5
ɛ0 v ɛ0 m,4
ɛ0 v eː0 ʃ,4
ɛ0 v eː0 t,4
ɛ0 v eː0 l,4
ɛ0 v eː0 n,4
ɛ0 ɟː ɛ0 l,4
ɛ0 dz ɛ0 tː,4
ɛ0 dz eː0 ʃ,4
ɛ0 j t ɛ0 tː,5
ɛ0 j t ɛ0 m,5
ɛ0 j t eː0 j,5
ɛ0 j t øː0 n,5
ɛ0 j t øː0,4
ɛ0 j t i0,4
ɛ0 j t v ɛ0,5
ɛ0 j t v ɛ0 n ts,7
ɛ0 j t v ɛ0 n,6
ɛ0 p ɛ0 tː,4
ɛ0 p ɛ0 r,4
ɛ0 p ɛ0 l,4
ɛ0 ʃː ɛ0 n,4
ɛ0 ʃː ɛ0,3
ɛ0 ʃː eː0 k,4
ɛ0 tʃ ɛ0 ʃ,4
ɛ0 tʃ ɛ0 t,4
ɑ0 h o0 l,4
ɑ0 h o0 ɟ,4
ɑ0 h h o0 z,5
ɑ0 h aː0 ɲ,4
ɑ0 nː ɑ0 k,4
ɑ0 nː aː0 l,4
ɑ0 nː o0,3
ɑ0 l ɑ0 tː,4
ɑ0 l ɑ0 p,4
ɑ0 l ɑ0 d,4
ɑ0 l ɑ0 d t,5
ɑ0 l ɑ0 d s,5
ɑ0 l ɑ0,3
ɑ0 l ɑ0 k,4
ɑ0 l ɑ0 t,4
ɑ0 l ɑ0 n g,5
ɑ0 l ɑ0 n d,5
ɑ0 l ɑ0 n t,5
ɑ0 l ɑ0 ts k,5
ɑ0 l ɑ0 j,4
ɑ0 l ɑ0 ʃ,4
ɑ0 l i0 g,4
ɑ0 l i0,3
ɑ0 l aː0 n,4
ɑ0 l aː0,3
ɑ0 l aː0 d,4
ɑ0 l aː0 l,4
ɑ0 l aː0 l t,5
ɑ0 l aː0 l s,5
ɑ0 l aː0 bː,4
ɑ0 l aː0 s,4
ɑ0 l aː0 ʃ,4
ɑ0 l aː0 t,4
ɑ0 l oː0,3
ɑ0 l oː0 l,4
ɑ0 l oː0 ʃ,4
ɑ0 l oː0 k,4
ɑ0 l oː0 t,4
ɑ0 l ʃ oː0,4
ɑ0 l ʃ oː0 bː,5
ɑ0 l b aː0 n,5
ɑ0 l b u0 m,5
ɑ0 l b ɑ0,4
ɑ0 l s i0 k,5
ɑ0 l s o0 m,5
ɑ0 l v aː0 ʃ,5
ɑ0 l v aː0 ɲ,5
ɑ0 l v oː0,4
ɑ0 l v ɑ0 k,5
ɑ0 l u0,3
ɑ0 l u0 d t,5
ɑ0 l u0 l,4
ɑ0 l u0 t,4
ɑ0 l u0 n,4
ɑ0 l j ɑ0 ʃ,5
ɑ0 l j ɑ0,4
ɑ0 l j aː0 n,5
ɑ0 l j aː0 n l,6
ɑ0 l j o0 n,5
ɑ0 l k ɑ0 n,5
ɑ0 l k o0 t,5
ɑ0 l m ɑ0,4
ɑ0 l m aː0 t,5
ɑ0 z t aː0 n,5
ɑ0 z o0 k,4
ɑ0 z o0 n,4
ɑ0 z ɑ0 z,4
ɑ0 z ɑ0,3
ɑ0 z n ɑ0 p,5
ɑ0 z eː0,3
ɑ0 zː ɑ0 l,4
ɑ0 zː aː0,3
ɑ0 k aː0 r,4
ɑ0 k aː0 ʃ,4
ɑ0 k aː0 ʃ t,5
ɑ0 k aː0 n,4
ɑ0 k aː0 t,4
ɑ0 k ɑ0 r,4
ɑ0 k ɑ0 r t,5
ɑ0 k ɑ0 r s,5
ɑ0 k ɑ0 t,4
ɑ0 k ɑ0 d,4
ɑ0 k ɑ0 d t,5
ɑ0 k ɑ0 s,4
ɑ0 k ɑ0 s t,5
ɑ0 k ɑ0,3
ɑ0 k ɑ0 tʃ,4
ɑ0 k i0 t,4
ɑ0 k i0 ʃ,4
ɑ0 k i0 k,4
ɑ0 k t iː0 v,5
ɑ0 k t ɑ0 m,5
ɑ0 k t ɑ0,4
ɑ0 k t ɑ0 k,5
ɑ0 k t u0 ʃ,5
ɑ0 k t aː0 k,5
ɑ0 rː oː0 l,4
ɑ0 rː eː0 bː,4
ɑ0 bː ɑ0 n,4
ɑ0 bː ɑ0,3
ɑ0 bː oː0 l,4
ɑ0 bː eː0,3
ɑ0 d o0 tː,4
ɑ0 d o0 k,4
ɑ0 d o0 m,4
ɑ0 d n i0,4
ɑ0 d n ɑ0 k,5
ɑ0 d n ɑ0 ɟ,5
ɑ0 d n ɑ0,4
ɑ0 d n o0 m,5
ɑ0 d n eː0 k,5
ɑ0 d j ɑ0,4
ɑ0 d j aː0 k,5
ɑ0 d j o0 n,5
ɑ0 d j u0 k,5
ɑ0 d j u0 n k,6
ɑ0 d t ɑ0,4
ɑ0 d t ɑ0 k,5
ɑ0 d t ɑ0 m,5
ɑ0 d t aː0 k,5
ɑ0 d t u0 n k,6
ɑ0 d oː0,3
ɑ0 d oː0 t,4
ɑ0 d oː0 k,4
ɑ0 d aː0 ʃ,4
ɑ0 d aː0 r,4
ɑ0 d aː0 s,4
ɑ0 d ɑ0 g,4
ɑ0 d ɑ0 t,4
ɑ0 d ɑ0 k,4
ɑ0 d u0 n k,5
ɑ0 d u0 l,4
ɑ0 d v ɑ0,4
ɑ0 d h ɑ0 t,5
ɑ0 m i0 n t,5
ɑ0 m i0 n t ʃ,6
ɑ0 m i0 n,4
ɑ0 m i0 n ts,5
ɑ0 m i0 ʃ,4
ɑ0 m i0 k,4
ɑ0 m iː0 g,4
ɑ0 m uː0 ɟ,4
ɑ0 m ɑ0 r,4
ɑ0 m ɑ0,3
ɑ0 m ɑ0 z,4
ɑ0 m ɑ0 t,4
ɑ0 m o0 tː,4
ɑ0 dː i0 g,4
ɑ0 n g o0 l,5
ɑ0 n g o0 l t,6
ɑ0 n g o0 n,5
ɑ0 n g o0 t,5
ɑ0 n g o0 ʃ,5
ɑ0 n g o0 k,5
ɑ0 n g j ɑ0,5
ɑ0 n g j aː0 t,6
ɑ0 n g j aː0 n,6
ɑ0 n g j aː0 n l,7
ɑ0 n g z i0 k,6
ɑ0 n g z o0 tː,6
ɑ0 n g z oː0,5
ɑ0 n g ʃ uː0 j t,7
ɑ0 n g ʃ uː0 j,6
ɑ0 n g uː0,4
ɑ0 n ɟ ɑ0 l,5
ɑ0 n ɟ o0 ʃ,5
ɑ0 n t i0 k,5
ɑ0 ɲː i0,3
ɑ0 ɲː i0 t,4
ɑ0 tː oː0 l,4
ɑ0 sː o0 ɲ,4
ɑ0 sː o0 ɲ t,5
ɑ0 ɲ ɑ0 g,4
ɑ0 ɲ ɑ0,3
ɑ0 ɲ ɑ0 tː,4
ɑ0 ɲ aː0 m,4
ɑ0 ɲ aː0 d,4
ɑ0 ɲ aː0 k,4
ɑ0 ɲ aː0 t,4
ɑ0 ɲ j ɑ0,4
ɑ0 ɲ j aː0 t,5
ɑ0 ɲ u0,3
ɑ0 p r oː0,4
ɑ0 p r oː0 l,5
ɑ0 p r oː0 bː,5
ɑ0 p r ɑ0,4
ɑ0 p aː0 n,4
ɑ0 p aː0 m,4
ɑ0 p aː0 ʃ,4
ɑ0 p aː0 ʃ t,5
ɑ0 p aː0 d,4
ɑ0 p aː0 k,4
ɑ0 p aː0 t,4
ɑ0 p ɑ0 t,4
ɑ0 p ɑ0,3
ɑ0 p ɑ0 d,4
ɑ0 p j ɑ0,4
ɑ0 p j aː0 n,5
ɑ0 p j aː0 n l,6
ɑ0 p j aː0 t,5
ɑ0 p j aː0 k,5
ɑ0 p j u0 k,5
ɑ0 p j o0 n,5
ɑ0 v ɑ0 j,4
ɑ0 v ɑ0 k,4
ɑ0 v ɑ0 ɟ,4
ɑ0 v ɑ0,3
ɑ0 v ɑ0 s,4
ɑ0 v ɑ0 r,4
ɑ0 v ɑ0 r t,5
ɑ0 v ɑ0 t,4
ɑ0 v ɑ0 ʃ,4
ɑ0 v ɑ0 zː,4
ɑ0 v ɑ0 m,4
ɑ0 v ɑ0 z,4
ɑ0 r ɑ0 d t,5
ɑ0 r ɑ0 d,4
ɑ0 r ɑ0 d s,5
ɑ0 r ɑ0 d j,5
ɑ0 r ɑ0 b,4
ɑ0 r ɑ0 ɲ,4
ɑ0 r ɑ0 n,4
ɑ0 r ɑ0 n tʃ,5
ɑ0 r ɑ0 s t,5
ɑ0 r ɑ0 ts k,5
ɑ0 r ɑ0 g,4
ɑ0 r ɑ0 t,4
ɑ0 r ts ɑ0,4
ɑ0 r ts aː0 t,5
ɑ0 r ts aː0 n,5
ɑ0 r ts i0,4
ɑ0 r ts o0 t,5
ɑ0 r ts o0 k,5
ɑ0 r ts o0 ʃ,5
ɑ0 r ts o0 l,5
ɑ0 r ts o0 l t,6
ɑ0 r ts o0 m,5
ɑ0 r ts b ɑ0 n,6
ɑ0 r ts b ɑ0,5
ɑ0 r ts uː0,4
ɑ0 r ts r ɑ0,5
ɑ0 r tsː ɑ0 l,5
ɑ0 r aː0 t,4
ɑ0 r aː0 ɲ,4
ɑ0 r aː0 n,4
ɑ0 r aː0 l t,5
ɑ0 r aː0 ʒ,4
ɑ0 c ɑ0,3
ɑ0 c j ɑ0,4
ɑ0 c aː0 m,4
ɑ0 c aː0 t,4
ɑ0 j t ɑ0,4
ɑ0 j t ɑ0 m,5
ɑ0 j t ɑ0 d,5
ɑ0 j t oː0,4
ɑ0 j t oː0 t,5
ɑ0 j t oː0 n,5
ɑ0 j t oː0 k,5
ɑ0 j t u0 k,5
ɑ0 j t u0 n k,6
ɑ0 j t o0 tː,5
ɑ0 j t o0 ʃ,5
ɑ0 j t o0 t,5
ɑ0 j t aː0 ʃ t,6
ɑ0 j t aː0 ʃ,5
ɑ0 j t j ɑ0,5
ɑ0 j k ɑ0,4
ɑ0 j k aː0 t,5
ɑ0 j aː0 t,4
ɑ0 j aː0 n,4
ɑ0 j aː0 n l,5
ɑ0 b l ɑ0 k,5
ɑ0 b l oː0,4
ɑ0 b s u0 r d,6
ɑ0 b s t r ɑ0,6
ɑ0 b s t r ɑ0 k t,8
ɑ0 s t ɑ0 l,5
ɑ0 s t ɑ0 l t,6
ɑ0 s ɑ0,3
ɑ0 s ɑ0 l t,5
ɑ0 s f ɑ0 l t,6
ɑ0 ts eː0 l,4
ɑ0 ɟ ɑ0 m,4
ɑ0 ɟ ɑ0 r t,5
ɑ0 ɟ ɑ0,3
ɑ0 ɟ o0 bː,4
ɑ0 ɟ o0 t,4
ɑ0 ɟ o0 tː,4
ɑ0 ɟ o0 n,4
ɑ0 ɟ o0 n t,5
ɑ0 ɟ o0 m,4
ɑ0 ɟ o0 k,4
ɑ0 ɟ o0 g,4
ɑ0 ɟ o0 d,4
ɑ0 ɟ i0 ʃ,4
ɑ0 ɟ i0,3
ɑ0 ɟ aː0 t,4
ɑ0 t o0 tː,4
ɑ0 t o0 m,4
ɑ0 t o0 l t,5
ɑ0 gː oː0 d j,5
ʃ ɑ0 j aː0 t,5
ʃ ɑ0 j aː0 n,5
ʃ ɑ0 j aː0 n l,6
ʃ ɑ0 j n o0 ʃ,6
ʃ ɑ0 j n o0 k,6
ʃ ɑ0 j n ɑ0 l,6
ʃ ɑ0 j n ɑ0,5
ʃ ɑ0 j t ɑ0,5
ʃ ɑ0 j t ɑ0 m,6
ʃ ɑ0 j t ɑ0 d,6
ʃ ɑ0 j t oː0,5
ʃ ɑ0 j t oː0 t,6
ʃ ɑ0 j t oː0 n,6
ʃ ɑ0 j t oː0 k,6
ʃ ɑ0 j t u0 k,6
ʃ ɑ0 j t u0 n k,7
ʃ ɑ0 j t o0 tː,6
ʃ ɑ0 j t o0 ʃ,6
ʃ ɑ0 j t o0 t,6
ʃ ɑ0 j t aː0 ʃ t,7
ʃ ɑ0 j t aː0 ʃ,6
ʃ ɑ0 j t j ɑ0,6
ʃ ɑ0 r k ɑ0 ʃ,6
ʃ ɑ0 r k ɑ0,5
ʃ ɑ0 r k b ɑ0 n,7
ʃ ɑ0 r k aː0 n,6
ʃ ɑ0 r k aː0 t,6
ʃ ɑ0 r k i0,5
ʃ ɑ0 r k o0 n,6
ʃ ɑ0 r o0 m,5
ʃ ɑ0 r o0 k,5
ʃ ɑ0 p k ɑ0,5
ʃ ɑ0 v ɑ0 j,5
ʃ ɑ0 v ɑ0 k,5
ʃ ɑ0 v ɑ0 ɟ,5
ʃ ɑ0 v ɑ0,4
ʃ ɑ0 v ɑ0 s,5
ʃ ɑ0 v ɑ0 r,5
ʃ ɑ0 v ɑ0 r t,6
ʃ ɑ0 v ɑ0 t,5
ʃ ɑ0 v ɑ0 ʃ,5
ʃ ɑ0 v ɑ0 zː,5
ʃ ɑ0 v ɑ0 m,5
ʃ ɑ0 v ɑ0 z,5
ʃ ɛ0 mː i0,4
ʃ ɛ0 mː i0 t,5
ʃ ɛ0 mː i0 n t,6
ʃ ɛ0 n k i0,5
ʃ ɛ0 n k i0 t,6
ʃ ɛ0 g iː0 t,5
ʃ ɛ0 g iː0 t ʃ,6
ʃ ɛ0 g iː0 r t,6
ʃ ɛ0 g eː0 ɲ,5
ʃ ɛ0 g eː0 ɲ t,6
ʃ ɛ0 g eː0 r,5
ʃ ɛ0 g eː0 r t,6
ʃ ɛ0 g eː0 d,5
ʃ ɛ0 g eː0 l t,6
ʃ ɛ0 h o0 ɟ,5
ʃ ɛ0 h o0 l,5
ʃ ɛ0 m h o0 ɟ,6
ʃ ɛ0 r ɛ0 k,5
ʃ ɛ0 r ɛ0 t,5
ʃ ɛ0 r ɛ0 t s,6
ʃ ɛ0 r ɛ0 ʃ,5
ʃ ɛ0 r ɛ0,4
ʃ ɛ0 r ɛ0 m,5
ʃ ɛ0 r ɛ0 m t,6
ʃ ɛ0 r ɛ0 d,5
ʃ ɛ0 r ɛ0 d t,6
ʃ ɛ0 r ɛ0 p,5
ʃ ɛ0 r ɛ0 v,5
ʃ ɛ0 r ɛ0 z,5
ʃ ɛ0 r ɛ0 z d,6
ʃ ɛ0 r ɛ0 s t,6
ʃ ɛ0 r ɛ0 l t,6
ʃ ɛ0 r ɛ0 g,5
ʃ ɛ0 r ɛ0 ʃː,5
ʃ ɛ0 j ɛ0 tː,5
ʃ ɛ0 j ɛ0 k,5
ʃ ɛ0 j ɛ0 n,5
ʃ ɛ0 j ɛ0 t,5
ʃ ɛ0 j ɛ0 ʃ,5
ʃ ɛ0 j ɛ0,4
ʃ ɛ0 j ɛ0 m,5
ʃ ɛ0 j ɛ0 d,5
ʃ ɛ0 j ɛ0 d t,6
ʃ ɛ0 j t ɛ0 tː,6
ʃ ɛ0 j t ɛ0 m,6
ʃ ɛ0 j t eː0 j,6
ʃ ɛ0 j t øː0 n,6
ʃ ɛ0 j t øː0,5
ʃ ɛ0 j t i0,5
ʃ ɛ0 j t v ɛ0,6
ʃ ɛ0 j t v ɛ0 n ts,8
ʃ ɛ0 j t v ɛ0 n,7
ʃ ɛ0 j m ɛ0 ʃ,6
ʃ ɛ0 b ɑ0 j,5
ʃ ɛ0 b ɛ0 g,5
ʃ ɛ0 b ɛ0 t,5
ʃ o0 h ɑ0,4
ʃ o0 h ɑ0 d t,6
ʃ o0 h ɑ0 n t,6
ʃ o0 h ɑ0 n,5
ʃ o0 h ɑ0 m,5
ʃ o0 kː ɑ0 l,5
