word,len
f ɛ0 j b ɛ0 n,6
f ɛ0 j b ɛ0,5
f ɛ0 j b øː0 l,6
f ɛ0 j y0 tː,5
f ɛ0 j y0 n k,6
f ɛ0 j y0 k,5
f ɛ0 j t ɛ0 tː,6
f ɛ0 j t ɛ0 m,6
f ɛ0 j t eː0 j,6
f ɛ0 j t øː0 n,6
f ɛ0 j t øː0,5
f ɛ0 j t i0,5
f ɛ0 j t v ɛ0,6
f ɛ0 j t v ɛ0 n ts,8
f ɛ0 j t v ɛ0 n,7
f ɛ0 n t i0,5
f ɛ0 n t i0 ʃ,6
f ɛ0 n t ɛ0 m,6
f ɛ0 n t ɛ0 k,6
f ɛ0 n t ɛ0 ʃ,6
f ɛ0 n t ɛ0 bː,6
f ɛ0 n t eː0 n,6
f ɛ0 n t y0 n k,7
f ɛ0 n t r u0 m,7
f ɛ0 n t ʃ eː0 g,7
f ɛ0 n t øː0 k,6
f ɛ0 n ɛ0,4
f ɛ0 n ɛ0 t,5
f ɛ0 k v øː0,5
f ɛ0 k v aː0 r t,7
f ɛ0 k v aː0 r,6
f ɛ0 k v ɛ0,5
f ɛ0 k s i0 k,6
f ɛ0 k y0 n k,6
f ɛ0 k y0 d t,6
f ɛ0 ʃ t ɛ0,5
f ɛ0 ʃ t ɛ0 r,6
f ɛ0 ʃ t ɛ0 t,6
f ɛ0 ʃ t ɛ0 tː,6
f ɛ0 ʃ t ɛ0 m,6
f ɛ0 ʃ t ɛ0 k,6
f ɛ0 ʃ t ɛ0 d,6
f ɛ0 ʃ t i0,5
f ɛ0 ʃ t i0 g,6
f ɛ0 ʃ t øː0,5
f ɛ0 ʃ t v eː0 r,7
f ɛ0 ʃ t v ɛ0,6
f ɛ0 ʃ t v ɛ0 n ts,8
f ɛ0 ʃ t v ɛ0 n,7
f ɛ0 ʃ t eː0 t,6
f ɛ0 ʃ t eː0 n,6
f ɛ0 ʃ t eː0 k,6
f ɛ0 ʃ t eː0 ʃ,6
f ɛ0 ʃ t b ɛ0 n,7
f ɛ0 ʃ t b ɛ0,6
f ɛ0 ʃ t b øː0 l,7
f ɛ0 ʃ t m eː0 ɲ,7
f ɛ0 ʃ t m eː0 ɲ t,8
f ɛ0 ʃ t yː0,5
f ɛ0 ʃ t y0 k,6
f ɛ0 ʃ t y0 n k,7
f ɛ0 ʃ t n ɛ0 k,7
f ɛ0 ɟ v ɛ0 n ts,7
f ɛ0 ɟ v ɛ0 n,6
f ɛ0 ɟ v ɛ0 r,6
f ɛ0 ɟ v ɛ0 r t,7
f ɛ0 s y0 n k,6
f ɛ0 s y0 l t,6
f ɛ0 s y0 l,5
f ɛ0 d ɛ0 tː,5
f ɛ0 d i0,4
f ɛ0 d eː0 l,5
f ɛ0 d t ɛ0,5
f ɛ0 d t ɛ0 m,6
f ɛ0 d t ɛ0 k,6
f ɛ0 nː aː0 lː,5
f ɛ0 r d ɑ0,5
f ɛ0 r d aː0 n,6
f ɛ0 r d øː0,5
f ɛ0 r d øː0 k,6
f ɛ0 r d ɛ0,5
f ɛ0 r t ɛ0,5
f ɛ0 r t ɛ0 ʃ,6
f ɛ0 r t ɛ0 m,6
f ɛ0 r t ɛ0 k,6
f ɛ0 r t ɛ0 t,6
f ɛ0 r t b ɛ0 n,7
f ɛ0 r t b ɛ0,6
f ɛ0 r t b øː0 l,7
f ɛ0 r t h o0 ɟ,7
f ɛ0 r t i0,5
f ɛ0 r t eː0 s,6
f ɛ0 r t j ɛ0,6
f ɛ0 r t øː0 z,6
f o0 n t o0 ʃ,6
f o0 n t o0 n,6
f o0 n t o0 tː,6
f o0 n t o0 t,6
f o0 n t o0 k,6
f o0 n t aː0 n,6
f o0 n t aː0 k,6
f o0 n t aː0 ʃ,6
f o0 n t ɑ0,5
f o0 n t b ɑ0 n,7
f o0 n t b ɑ0,6
f o0 n t j ɑ0,6
f o0 n t j aː0 n,7
f o0 n t j aː0 k,7
f o0 n t r o0 lː,7
f o0 n t r ɑ0,6
f o0 n t i0,5
f o0 g j ɑ0,5
f o0 g j aː0 k,6
f o0 g j u0 k,6
f o0 g j u0 l,6
f o0 g j o0 k,6
f o0 g v ɑ0,5
f o0 g n ɑ0 k,6
f o0 g n i0,5
f o0 g o0 k,5
f o0 g o0 m,5
f o0 g o0 ʃ,5
f o0 g o0 t,5
f o0 g o0 tː,5
f o0 g o0 d,5
f o0 g o0 j,5
f o0 g u0 n k,6
f o0 g u0 k,5
f o0 g t ɑ0,5
f o0 g t ɑ0 k,6
f o0 g t ɑ0 m,6
f o0 g t o0 k,6
f o0 g t aː0 k,6
f o0 g l ɑ0 l,6
f o0 g l ɑ0 l t,7
f o0 g ɑ0,4
f o0 g ɑ0 d,5
f o0 g aː0 ɲ,5
f o0 g aː0 t,5
f o0 g aː0 ʃ,5
f o0 g aː0 ʃ t,6
f o0 rː aː0 ʃ,5
f o0 rː aː0 ʃ t,6
f o0 rː aː0 t,5
f o0 rː oː0,4
f o0 t oː0,4
f o0 t oː0 k,5
f o0 t oː0 ʃ,5
f o0 t oː0 t,5
f o0 r i0 n t,6
f o0 r i0,4
f o0 r i0 t,5
f o0 r i0 g,5
f o0 r i0 k,5
f o0 r d u0 l t,7
f o0 r d u0 l,6
f o0 r d u0 l j,7
f o0 r d j ɑ0,6
f o0 r d j ɑ0 m,7
f o0 r d j ɑ0 k,7
f o0 r d j aː0 k,7
f o0 r d oː0,5
f o0 r d o0 z,6
f o0 r d t ɑ0,6
f o0 r d t ɑ0 m,7
f o0 r d t ɑ0 d,7
f o0 r d t ɑ0 k,7
f o0 r m aː0 ɲ,6
f o0 r m aː0 ɲ t,7
f o0 r m aː0 k,6
f o0 r m aː0 t,6
f o0 r m aː0 l,6
f o0 r m ɑ0,5
f o0 r o0 s,5
f o0 r o0 ʃ,5
f o0 r o0 n,5
f o0 r o0 g,5
f o0 r o0 k,5
f o0 r o0 ɲ,5
f o0 r o0 ɲ t,6
f o0 r g oː0,5
f o0 r g o0 ʃ,6
f o0 j i0 k,5
f o0 j oː0,4
f o0 j oː0 n,5
f o0 j t o0 n,6
f o0 j t aː0 n,6
f o0 j t ɑ0 t,6
f o0 j t ɑ0 k,6
f o0 j n ɑ0 k,6
f o0 k r ɑ0,5
f o0 k r o0 k,6
f o0 k o0 tː,5
f o0 k o0 ʃ,5
f o0 k o0 z,5
f o0 k o0 l,5
f o0 k o0 k,5
f o0 k o0 t,5
f o0 k o0 n,5
f o0 k o0 m,5
f o0 k o0 r,5
f o0 k i0 g,5
f o0 k i0,4
f o0 k i0 ʃ,5
f o0 k i0 t,5
f o0 k aː0 ʃ,5
f o0 k aː0 ʃ t,6
f o0 k aː0 t,5
f o0 k aː0 n,5
f o0 k aː0,4
f o0 k uː0,4
f o0 k b oː0 l,6
f o0 k b ɑ0 n,6
f o0 k b ɑ0,5
f o0 k ɑ0 t,5
f o0 k ɑ0 n,5
f o0 k ɑ0,4
f o0 k ɑ0 k,5
f o0 ts i0,4
f o0 ɟ ɑ0 n,5
f o0 ɟ ɑ0 s t,6
f o0 ɟ o0 tː,5
f o0 d r o0 ɲ,6
f o0 d r o0 ɲ t,7
f o0 d r aː0 s,6
f o0 kː ɑ0 l,5
f eː0 r f i0,5
f eː0 r f i0 t,6
f eː0 r f ø0 l d,7
f eː0 r j ɛ0,5
f eː0 r j ɛ0 m,6
f eː0 r j ɛ0 n,6
f eː0 r j y0 k,6
f eː0 r j y0 n k,7
f eː0 r j h ɛ0 z,7
f eː0 r j eː0 t,6
f eː0 r ɑ0,4
f eː0 r n i0,5
f eː0 r n ɛ0 k,6
f eː0 r n ɛ0,5
f eː0 r n ø0 k,6
f eː0 r ɛ0 m,5
f eː0 r ɛ0 n,5
f eː0 r ɛ0 k,5
f eː0 r ɛ0 ʃ,5
f eː0 r ɛ0 z,5
f eː0 r ɛ0 tː,5
f eː0 r ɛ0 g,5
f eː0 r ɛ0 t,5
f eː0 r ɛ0,4
f eː0 r ɛ0 l t,6
f eː0 l i0 g,5
f eː0 l i0,4
f eː0 l i0 k,5
f eː0 l ɛ0 t,5
f eː0 l ɛ0 k,5
f eː0 l ɛ0 ʃ,5
f eː0 l ɛ0 n,5
f eː0 l ɛ0 m,5
f eː0 l ɛ0 l t,6
f eː0 l t oː0,5
f eː0 l t ɛ0 k,6
f eː0 l t ɛ0 m,6
f eː0 l t ɛ0,5
f eː0 l t aː0 n,6
f eː0 l t y0 n k,7
f eː0 l r ɑ0,5
f eː0 l r ɛ0,5
f eː0 l n i0,5
f eː0 l n ɛ0 k,6
f eː0 l n ɛ0,5
f eː0 l n ɑ0 k,6
f eː0 l n eː0 n k,7
f eː0 l n y0 n k,7
f eː0 l b ɑ0,5
f eː0 l b oː0 l,6
f eː0 l b ɛ0 n,6
f eː0 l b ɛ0,5
f eː0 l y0 n k,6
f eː0 l øː0,4
f eː0 l øː0 k,5
f eː0 l j ɑ0,5
f eː0 l j ɛ0 n,6
f eː0 l j ɛ0 k,6
f eː0 l j aː0 t,6
f eː0 l j y0 k,6
f eː0 l j y0 n k,7
f eː0 l j u0 k,6
f eː0 ɲ ɛ0 g,5
f eː0 ɲ ɛ0 ʃ,5
f eː0 ɲ ɛ0 k,5
f eː0 ɲ ɛ0,4
f eː0 ɲ b ɛ0 n,6
f eː0 ɲ k eː0 p,6
f eː0 ɲ k eː0 n,6
f eː0 ɲ k eː0 n t,7
f eː0 ɲ l ɛ0 g,6
f eː0 ɲ l øː0,5
f eː0 ɲː ɛ0 l,5
f øː0 l ɛ0,4
f øː0 l ɛ0 g,5
f øː0 l ɛ0 m,5
f øː0 l ɛ0 d,5
f øː0 k eː0 n t,6
f øː0 k eː0 t,5
f øː0 k eː0 ʃ,5
f øː0 n ø0 k,5
f øː0 z n i0,5
f øː0 z eː0 ʃ,5
f øː0 z ø0 tː,5
f øː0 z ø0 k,5
f øː0 z t ɛ0 ʃ,6
f øː0 z t ɛ0 m,6
f øː0 r ɛ0,4
f ø0 l d ø0 n,6
f ø0 l d i0,5
f ø0 l d i0 g,6
f ø0 l d ɛ0 t,6
f ø0 l d r ɛ0,6
f ø0 l d r øː0 l,7
f ø0 l d b ɛ0,6
f ø0 l d b ɛ0 n,7
f ø0 l d b øː0 l,7
f ø0 l d j ɛ0,6
f ø0 l d j eː0 n,7
f ø0 l d j eː0 t,7
f ø0 l d ʃ eː0 g,7
f ø0 l d n ɛ0 k,7
f ø0 l d h ø0 z,7
f ø0 l ø0 tː,5
f ø0 l eː0,4
f ø0 l dː ɛ0 l,6
f u0 r tʃ ɑ0,5
f u0 r tʃ aː0 n,6
f u0 r ɑ0 m,5
f u0 r ɑ0 t,5
f u0 r ɑ0,4
f u0 r ɑ0 k,5
f u0 r aː0 n,5
f u0 t o0 tː,5
f u0 t o0 k,5
f u0 t oː0,4
f u0 t oː0 bː,5
f u0 t oː0 d,5
f u0 t aː0 ʃ,5
f u0 t aː0 r,5
f u0 t n i0,5
f u0 t n ɑ0 k,6
f u0 t n ɑ0,5
f u0 t ɑ0 t,5
f u0 t ɑ0 l,5
f u0 t ɑ0 l t,6
f u0 t ɑ0 k,5
f u0 t ɑ0 ʃ,5
f u0 t ɑ0 ʃ d,6
f u0 t ɑ0,4
f u0 t ɑ0 m,5
f u0 t b ɑ0 lː,6
f u0 t j ɑ0,5
f i0 uː0,3
f i0 uː0 k,4
f i0 uː0 m,4
f i0 uː0 t,4
f i0 ɑ0,3
f i0 ɑ0 m,4
f i0 n o0 m,5
f i0 n o0 ʃ,5
f i0 l m ɛ0 t,6
f i0 l m ɛ0 k,6
f i0 l m ɛ0 ʃ,6
f i0 l m b ɛ0 n,7
f i0 l m j ɛ0,6
f i0 l m j eː0 t,7
f i0 l m r øː0 l,7
f i0 aː0 t,4
f i0 z ɛ0 t,5
f i0 z ɛ0 ʃ,5
f i0 z ɛ0,4
f i0 z ɛ0 k,5
f i0 ɟ ɛ0 l,5
f i0 ɟ ɛ0 l t,6
f i0 ɟ ɛ0 l j,6
f i0 ɟ ɛ0 l d,6
f i0 ɟ ɛ0,4
f i0 ɟ ɛ0 n,5
f i0 ts k oː0,5
f ɑ0 j t ɑ0,5
f ɑ0 j t ɑ0 m,6
f ɑ0 j t ɑ0 d,6
f ɑ0 j t oː0,5
f ɑ0 j t oː0 t,6
f ɑ0 j t oː0 n,6
f ɑ0 j t oː0 k,6
f ɑ0 j t u0 k,6
f ɑ0 j t u0 n k,7
f ɑ0 j t o0 tː,6
f ɑ0 j t o0 ʃ,6
f ɑ0 j t o0 t,6
f ɑ0 j t aː0 ʃ t,7
f ɑ0 j t aː0 ʃ,6
f ɑ0 j t j ɑ0,6
f ɑ0 j i0,4
f ɑ0 l u0,4
f ɑ0 l u0 d t,6
f ɑ0 l u0 l,5
f ɑ0 l u0 t,5
f ɑ0 l u0 n,5
f ɑ0 l ɑ0 tː,5
f ɑ0 l ɑ0 p,5
f ɑ0 l ɑ0 d,5
f ɑ0 l ɑ0 d t,6
f ɑ0 l ɑ0 d s,6
f ɑ0 l ɑ0,4
f ɑ0 l ɑ0 k,5
f ɑ0 l ɑ0 t,5
f ɑ0 l ɑ0 n g,6
f ɑ0 l ɑ0 n d,6
f ɑ0 l ɑ0 n t,6
f ɑ0 l ɑ0 ts k,6
f ɑ0 l ɑ0 j,5
f ɑ0 l ɑ0 ʃ,5
f ɑ0 l o0 tː,5
f ɑ0 l o0 g,5
f ɑ0 l o0 n,5
f ɑ0 l o0 k,5
f ɑ0 l o0 m,5
f ɑ0 l r ɑ0,5
f ɑ0 l r oː0 l,6
f ɑ0 l h o0 z,6
f ɑ0 l n ɑ0 k,6
f ɑ0 l n i0,5
f ɑ0 l v aː0 ʃ,6
f ɑ0 l v aː0 ɲ,6
f ɑ0 l v oː0,5
f ɑ0 l v ɑ0 k,6
f ɑ0 l b aː0 n,6
f ɑ0 l b u0 m,6
f ɑ0 l b ɑ0,5
f ɑ0 r k ɑ0 ʃ,6
f ɑ0 r k ɑ0,5
f ɑ0 r k b ɑ0 n,7
f ɑ0 r k aː0 n,6
f ɑ0 r k aː0 t,6
f ɑ0 r k i0,5
f ɑ0 r k o0 n,6
f ɑ0 k ɑ0 r,5
f ɑ0 k ɑ0 r t,6
f ɑ0 k ɑ0 r s,6
f ɑ0 k ɑ0 t,5
f ɑ0 k ɑ0 d,5
f ɑ0 k ɑ0 d t,6
f ɑ0 k ɑ0 s,5
f ɑ0 k ɑ0 s t,6
f ɑ0 k ɑ0,4
f ɑ0 k ɑ0 tʃ,5
f ɑ0 k oː0 k,5
f ɑ0 k oː0,4
f ɑ0 k iː0 r,5
f ɑ0 ɟ o0 bː,5
f ɑ0 ɟ o0 t,5
f ɑ0 ɟ o0 tː,5
f ɑ0 ɟ o0 n,5
f ɑ0 ɟ o0 n t,6
f ɑ0 ɟ o0 m,5
f ɑ0 ɟ o0 k,5
f ɑ0 ɟ o0 g,5
f ɑ0 ɟ o0 d,5
f ɑ0 ɟ i0 ʃ,5
f ɑ0 ɟ i0,4
f ɑ0 i0 r,4
f ɑ0 s ɑ0,4
f ɑ0 s ɑ0 l t,6
f ɑ0 z o0 k,5
f ɑ0 z o0 n,5
f oː0 r u0 m,5
f oː0 k ɑ0,4
f oː0 k ɑ0 t,5
f r ɑ0 n k o0 t,7
f r ɑ0 n k o0 k,7
f r ɑ0 n k aː0 r,7
f r ɑ0 n k ø0 ɲ v,8
f r ɑ0 n g o0 l,7
f r ɑ0 n g o0 l t,8
f r ɑ0 n g o0 n,7
f r ɑ0 n g o0 t,7
f r ɑ0 n g o0 ʃ,7
f r ɑ0 n g o0 k,7
f r ɑ0 n g j ɑ0,7
f r ɑ0 n g j aː0 t,8
f r ɑ0 n g j aː0 n,8
f r ɑ0 n g z i0 k,8
f r ɑ0 n g z o0 tː,8
f r ɑ0 n g z oː0,7
f r ɑ0 n g ʃ uː0 j,8
f r ɑ0 n g uː0,6
f r ɑ0 n d ɑ0 r d,8
f r ɑ0 n d ɑ0,6
f r ɑ0 n d o0 n,7
f r ɑ0 n kː ɑ0 l,7
f r ɑ0 pː aː0 n ʃ,7
f r i0 ʃː ɛ0 n,6
f r o0 n d t ɑ0,7
f r o0 n d t ɑ0 m,8
f r o0 n d t ɑ0 d,8
f r o0 n d t ɑ0 k,8
f r o0 n d t aː0 k,8
f r o0 n d t aː0 l,8
f r o0 n d t u0 k,8
f r o0 n d j ɑ0,7
f r o0 n d j ɑ0 m,8
f r o0 n d j ɑ0 k,8
f r o0 n d j u0 k,8
f r o0 n d j aː0 k,8
f r o0 n d j o0 n,8
f r o0 n d o0 m,7
f r o0 n d o0 tː,7
f r o0 n d o0 l,7
f r o0 n d o0 l t,8
f r o0 n d o0 l s,8
f r o0 n d o0 l j,8
f r o0 n d o0 l d,8
f r o0 n d o0 k,7
f r o0 n d o0 t,7
f r o0 n d o0 d,7
f r o0 n d o0 ʃ,7
f r o0 n d ɑ0 t,7
f r o0 n d ɑ0,6
f r o0 n d ɑ0 s,7
f r o0 n d v ɑ0,7
f r o0 n d v aː0 n,8
f r o0 n d aː0 ʃ,7
f r o0 n d u0 n k,8
f r o0 n d h ɑ0 t,8
f r o0 n t o0 ʃ,7
f r o0 n t o0 n,7
f r o0 n t o0 tː,7
f r o0 n t o0 t,7
f r o0 n t o0 k,7
f r o0 n t aː0 n,7
f r o0 n t aː0 k,7
f r o0 n t aː0 ʃ,7
f r o0 n t ɑ0,6
f r o0 n t b ɑ0 n,8
f r o0 n t b ɑ0,7
f r o0 n t j ɑ0,7
f r o0 n t j aː0 n,8
f r o0 n t j aː0 k,8
f r o0 n t r o0 lː,8
f r o0 n t r ɑ0,7
f r o0 n t i0,6
f aː0 r ɑ0,4
f aː0 r ɑ0 z,5
f aː0 r ɑ0 k,5
f aː0 r ɑ0 d t,6
f aː0 r ɑ0 d,5
f aː0 r ɑ0 t,5
f aː0 r ɑ0 m,5
f aː0 r ɑ0 n,5
f aː0 r ɑ0 s t,6
f aː0 b oː0 l,5
f aː0 k ɑ0 t,5
f aː0 k j aː0 t,6
f aː0 j oː0,4
f aː0 n ɑ0 t,5
f aː0 n ɑ0 k,5
f y0 gː ø0 ɲ,5
f y0 gː ø0 ɲ t,6
f y0 gː ø0 tː,5
f y0 l ɛ0,4
f y0 l ɛ0 m,5
f y0 l eː0 ʃ,5
f y0 l eː0 ʃ t,6
f y0 l eː0 t,5
f y0 v ɛ0 g,5
f y0 v ɛ0 t,5
f y0 v ɛ0 ʃ,5
f y0 r d øː0,5
f y0 z ɛ0 t,5
f y0 z ɛ0 ʃ,5
f y0 z ɛ0 n t,6
f y0 ʃ t eː0 n t,7
f y0 ʃ t ø0 l t,7
f yː0 t eː0 ʃ,5
f yː0 z ø0 tː,5
f yː0 z t ɛ0,5
d o0 l o0 g,5
d o0 l o0 tː,5
d o0 l o0 n d,6
d o0 l g o0 k,6
d o0 l g o0 t,6
d o0 l g o0 m,6
d o0 l g o0 n,6
d o0 l g o0 d,6
d o0 l g ɑ0,5
d o0 l g aː0 l,6
d o0 l g aː0 l t,7
d o0 l g aː0 r,6
d o0 l g aː0 t,6
d o0 l g aː0 k,6
d o0 l g u0 n k,7
d o0 l g u0 k,6
d o0 k t o0 r,6
d o0 k t ɑ0 m,6
d o0 k t ɑ0 k,6
d o0 k t ɑ0,5
d o0 k t aː0 k,6
d o0 k t aː0 l,6
d o0 k t u0 n k,7
d o0 lː aː0 r,5
d o0 lː aː0 r t,6
d o0 b o0 z,5
d o0 b o0 z t,6
d o0 b o0 r,5
d o0 b o0 t,5
d o0 b o0 tː,5
d o0 b o0 k,5
d o0 b t ɑ0,5
d r aː0 g ɑ0,5
d r aː0 g ɑ0 ʃ,6
d r aː0 g ɑ0 bː,6
d r aː0 g ɑ0 k,6
d r aː0 g aː0 bː,6
d r aː0 g aː0 ɲ,6
d r aː0 g aː0 ʃ,6
d r aː0 g aː0 k,6
d r aː0 m ɑ0,5
d r aː0 m ɑ0 d t,7
d r aː0 m ɑ0 d,6
d r aː0 m ɑ0 s t,7
d aː0 t u0 m,5
d aː0 t u0 n k,6
d aː0 t u0 l,5
d ɑ0 r ɑ0 d t,6
d ɑ0 r ɑ0 d,5
d ɑ0 r ɑ0 d s,6
d ɑ0 r ɑ0 d j,6
d ɑ0 r ɑ0 b,5
d ɑ0 r ɑ0 ɲ,5
d ɑ0 r ɑ0 n,5
d ɑ0 r ɑ0 n tʃ,6
d ɑ0 r ɑ0 s t,6
d ɑ0 r ɑ0 ts k,6
d ɑ0 r ɑ0 g,5
d ɑ0 r ɑ0 t,5
d ɑ0 r aː0 t,5
d ɑ0 r aː0 ɲ,5
d ɑ0 r aː0 n,5
d ɑ0 r aː0 l t,6
d ɑ0 r aː0 ʒ,5
d ɑ0 l aː0 n,5
d ɑ0 l aː0,4
d ɑ0 l aː0 d,5
d ɑ0 l aː0 l,5
d ɑ0 l aː0 l t,6
d ɑ0 l aː0 l s,6
d ɑ0 l aː0 bː,5
d ɑ0 l aː0 s,5
d ɑ0 l aː0 ʃ,5
d ɑ0 l aː0 t,5
d ɑ0 l o0 tː,5
d ɑ0 l o0 g,5
d ɑ0 l o0 n,5
d ɑ0 l o0 k,5
d ɑ0 l o0 m,5
d eː0 l i0 g,5
d eː0 l i0,4
d eː0 l i0 k,5
d eː0 l b ɑ0,5
d eː0 l b oː0 l,6
d eː0 l b ɛ0 n,6
d eː0 l b ɛ0,5
d eː0 l r ɑ0,5
d eː0 l r ɛ0,5
d eː0 l ɛ0 t,5
d eː0 l ɛ0 k,5
d eː0 l ɛ0 ʃ,5
d eː0 l ɛ0 n,5
d eː0 l ɛ0 m,5
d eː0 l ɛ0 l t,6
d eː0 m o0 n,5
d ø0 n t eː0 ʃ,6
d ø0 n t eː0 ʃ t,7
d ø0 n t ø0 tː,6
d ø0 n t øː0,5
d ø0 n t øː0 l,6
d ø0 n t i0,5
d ø0 n t ʃ ø0 n,7
d ø0 g l ø0 tː,6
d i0 v ɑ0 t,5
d i0 r ɛ0,4
d i0 r ɛ0 k t,6
d i0 aː0 k,4
d i0 s n ɛ0 k,6
d i0 s n oː0,5
d i0 s n oː0 k,6
d i0 s k o0 ʃ,6
d i0 s k r eː0 t,7
d i0 tʃ øː0,4
d i0 z aː0 r t,6
d i0 z aː0 j n,6
d u0 r v ɑ0,5
d u0 r v aː0 n,6
d u0 r v aː0 bː,6
d u0 p l ɑ0,5
d u0 m ɑ0,4
d u0 zː ɑ0 d t,6
d iː0 j ɑ0 t,5
d iː0 j ɑ0,4
d iː0 j ɑ0 k,5
d iː0 j aː0 n,5
d iː0 j aː0 t,5
d iː0 j j ɑ0 l,6
d iː0 j r ɑ0,5
d iː0 s ɛ0 ʃ,5
d ɛ0 r eː0 n,5
d ɛ0 r eː0 k,5
d ɛ0 r eː0 ɲ,5
d ɛ0 r eː0 s t,6
d ɛ0 r eː0 s,5
d ɛ0 r y0 l t,6
d ɛ0 r y0 l,5
d ɛ0 r y0 n k,6
d ɛ0 r yː0 ʃ,5
d ɛ0 ʃ i0 k,5
d ɛ0 ʃ i0 g n,6
d ɛ0 h o0 ɟ,5
d ɛ0 h o0 l,5
d ɛ0 s k ø0 z,6
d ɛ0 s k ø0 z t,7
d ɛ0 s k ɑ0,5
d ɛ0 sː ɛ0,4
d ɛ0 sː ɛ0 r t,6
d ɛ0 sː ɛ0 bː,5
d ɛ0 k ɑ0,4
d ɛ0 tː oː0,4
d y0 h ø0 ʃ,5
j o0 bː ɑ0 n,5
j o0 bː ɑ0 n t,6
j o0 bː ɑ0 t,5
j o0 bː ɑ0 k,5
j o0 bː r ɑ0,5
j o0 bː r oː0 l,6
j o0 bː i0 k,5
j o0 bː i0 t,5
j o0 bː i0,4
j o0 bː n ɑ0 k,6
j o0 bː o0 ʃ,5
j o0 g i0,4
j o0 g ɑ0,4
j o0 g ɑ0 d,5
j o0 g o0 k,5
j o0 g o0 m,5
j o0 g o0 ʃ,5
j o0 g o0 t,5
j o0 g o0 tː,5
j o0 g o0 d,5
j o0 g o0 j,5
j o0 g aː0 ɲ,5
j o0 g aː0 t,5
j o0 g aː0 ʃ,5
j o0 g aː0 ʃ t,6
j o0 g u0 n k,6
j o0 g u0 k,5
j o0 gː ɑ0 l,5
j ɛ0 l ɛ0,4
j ɛ0 l ɛ0 n t,6
j ɛ0 l ɛ0 n,5
j ɛ0 l ɛ0 m,5
j ɛ0 l ɛ0 g,5
j ɛ0 l ɛ0 tː,5
j ɛ0 l ɛ0 d,5
j ɛ0 l ɛ0 k,5
j ɛ0 l ɛ0 l,5
j ɛ0 l ɛ0 l t,6
j ɛ0 l ɛ0 t,5
j ɛ0 l ɛ0 dː,5
j ɛ0 l ɛ0 j t ʃ d,8
j ɛ0 l ɛ0 ʃ,5
j ɛ0 l ɛ0 p,5
j ɛ0 l z eː0 ʃ,6
j ɛ0 l z eː0 ʃ t,7
j ɛ0 l z i0,5
j ɛ0 l z i0 k,6
j ɛ0 l z øː0,5
j ɛ0 l z øː0 t,6
j ɛ0 l z ɛ0 tː,6
j ɛ0 l ø0 l t,6
j ɛ0 l ø0 l,5
j ɛ0 l s oː0,5
j ɛ0 l s aː0 n t,7
j ɛ0 l s iː0 n,6
j ɛ0 l s iː0 n t,7
j ɛ0 l eː0 g,5
j ɛ0 l eː0,4
j ɛ0 l eː0 t,5
j ɛ0 l eː0 m,5
j ɛ0 l eː0 r t,6
j ɛ0 l eː0 n k,6
j ɛ0 l eː0 n,5
j ɛ0 l eː0 p,5
j ɛ0 l m uː0 l t,7
j ɛ0 l m ɛ0,5
j ɛ0 l m ɛ0 n t,7
j ɛ0 l m ɛ0 n ʃ,7
j ɛ0 l m ɛ0 ɟ,6
j ɛ0 l m ɛ0 z,6
j ɛ0 l m ɛ0 z t,7
j ɛ0 l m eː0 t,6
j ɛ0 ɟ ɛ0 n,5
j ɛ0 ɟ ɛ0 ʃ,5
j ɛ0 ɟ ɛ0 ɟ,5
j ɛ0 ɟ ɛ0 t,5
j ɛ0 ɟ ɛ0 k,5
j ɛ0 ɟ ɛ0,4
j ɛ0 ɟ ɛ0 d,5
j ɛ0 ɟ ɛ0 m,5
j ɛ0 ɟ z øː0,5
j ɛ0 ɟ z i0,5
j ɛ0 ɟ z ɛ0 m,6
j ɛ0 ɟ z ɛ0 tː,6
j ɛ0 g ɛ0 d,5
j ɛ0 g ɛ0 t,5
j ɛ0 g ɛ0 ʃ,5
j ɛ0 g ɛ0 k,5
j ɛ0 lː ɛ0 tː,5
j ɛ0 lː ɛ0 n,5
j ɛ0 lː ɛ0 n t,6
j ɛ0 lː ɛ0 m,5
j ɛ0 lː ɛ0 g,5
j ɛ0 lː ɛ0,4
j u0 t o0 tː,5
j u0 t o0 k,5
j u0 t n i0,5
j u0 t n ɑ0 k,6
j u0 t n ɑ0,5
j u0 t u0 n k,6
j u0 t h ɑ0 t,6
j u0 ʃː o0 n,5
j ø0 v øː0,4
j ø0 v øː0 t,5
j ø0 v ø0 k,5
j ø0 v y0 n k,6
j ø0 nː ɛ0 k,5
j ø0 nː ɛ0 l,5
j ø0 nː ɛ0,4
j ø0 nː i0,4
j ø0 tː ɛ0 m,5
j ø0 tː ɛ0 k,5
j ø0 tː y0 n k,6
j ø0 tː eː0 l,5
j ø0 h ɛ0 t,5
j ø0 j j ø0 n,6
j aː0 t eː0 k,5
j aː0 t s i0 k,6
j aː0 t s o0 tː,6
j aː0 t s o0 m,6
j aː0 t s ɑ0 t,6
j aː0 t s oː0,5
j aː0 t s m ɑ0,6
j aː0 t s u0 n k,7
j aː0 t sː ɑ0,5
j aː0 r oː0,4
j aː0 r n ɑ0 k,6
j aː0 r n ɑ0,5
j aː0 r n i0,5
j aː0 r n o0 m,6
j aː0 r t ɑ0 m,6
j aː0 r t ɑ0,5
j aː0 r t ɑ0 k,6
j aː0 r t o0 k,6
j aː0 r t o0 tː,6
j aː0 r t o0 t,6
j aː0 r t u0 n k,7
j aː0 r t u0 k,6
j aː0 r t aː0 k,6
j aː0 r t aː0 ʃ,6
j aː0 r t aː0 l,6
j aː0 r t oː0,5
j aː0 r t oː0 k,6
j aː0 r t j ɑ0,6
j aː0 r t n ɑ0 k,7
j aː0 r t n aː0,6
j aː0 r t n aː0 l,7
j aː0 r o0 m,5
j aː0 r o0 ʃ,5
j aː0 r o0 ʃ t,6
j aː0 r o0 n,5
j aː0 r o0 k,5
j aː0 r o0 l t,6
j aː0 r d aː0 n,6
j aː0 r d ɑ0,5
j aː0 r d u0 ts,6
j aː0 r u0 n k,6
j aː0 r u0 l,5
j aː0 r u0 l t,6
j aː0 r u0,4
j aː0 r u0 k,5
j aː0 r m i0,5
j aː0 r m i0 t,6
j aː0 r m i0 n t,7
j aː0 r m i0 j,6
j aː0 r m ɛ0 j,6
j aː0 r m aː0 r,6
j aː0 r m ɑ0 n,6
j aː0 r m ɑ0 ʃ,6
j aː0 r m ɑ0 t,6
j aː0 r m yː0,5
j aː0 r j ɑ0,5
j aː0 r j aː0 k,6
j aː0 r j u0 k,6
j aː0 r j o0 n,6
j aː0 r aː0 n,5
j aː0 r aː0 t,5
j aː0 r aː0 ʃ,5
j aː0 r aː0 ɲ,5
j aː0 r aː0 ɲ t,6
j aː0 r ɑ0,4
j aː0 r ɑ0 z,5
j aː0 r ɑ0 k,5
j aː0 r ɑ0 d t,6
j aː0 r ɑ0 d,5
j aː0 r ɑ0 t,5
j aː0 r ɑ0 m,5
j aː0 r ɑ0 n,5
j aː0 r ɑ0 s t,6
j aː0 r h o0 l,6
j aː0 r h o0 ɟ,6
j aː0 r h ɑ0 t,6
j aː0 r h ɑ0,5
j aː0 r v iː0 z,6
j aː0 r v ɑ0,5
j aː0 r v aː0 ɲ,6
j aː0 r v aː0 ɲ t,7
j aː0 m b ɑ0 n,6
j aː0 m b ɑ0,5
j aː0 m b o0 r,6
j aː0 m b o0 r t,7
j aː0 m b aː0 r,6
j ɑ0 p aː0 n,5
j ɑ0 p aː0 m,5
j ɑ0 p aː0 ʃ,5
j ɑ0 p aː0 ʃ t,6
j ɑ0 p aː0 d,5
j ɑ0 p aː0 k,5
j ɑ0 p aː0 t,5
j ɑ0 v ɑ0 j,5
j ɑ0 v ɑ0 k,5
j ɑ0 v ɑ0 ɟ,5
j ɑ0 v ɑ0,4
j ɑ0 v ɑ0 s,5
j ɑ0 v ɑ0 r,5
j ɑ0 v ɑ0 r t,6
j ɑ0 v ɑ0 t,5
j ɑ0 v ɑ0 ʃ,5
j ɑ0 v ɑ0 zː,5
j ɑ0 v ɑ0 m,5
j ɑ0 v ɑ0 z,5
j ɑ0 v u0 l t,6
j oː0 v ɑ0 l,5
j oː0 v aː0,4
j oː0 z ɑ0 n,5
j oː0 z ɑ0,4
j oː0 n ɑ0 p,5
j oː0 n ɑ0 k,5
j oː0 n ɑ0,4
j oː0 r eː0 s t,6
j oː0 r ɑ0,4
j oː0 tʃ k aː0 n,6
j oː0 tʃ k ɑ0,5
j oː0 ʃ aː0 g,5
j oː0 k ɑ0,4
j oː0 k ɑ0 t,5
j oː0 g ɑ0,4
j oː0 g i0,4
j oː0 l eː0 t,5
oː0 t ɑ0,3
oː0 r ɑ0,3
oː0 r aː0 t,4
oː0 r aː0 n,4
oː0 r aː0 k,4
oː0 r aː0 ʃ,4
oː0 n o0 ʃ,4
oː0 tʃ k aː0 n,5
oː0 tʃ k ɑ0,4
oː0 z d i0,4
oː0 h ɑ0 j t,5
s i0 n t h ɑ0,6
s i0 n t h o0 ɟ,7
s i0 n t ɛ0,5
s i0 n t ɛ0 ɟ,6
s i0 n t ɛ0 n t,7
s i0 n t ɛ0 n,6
s i0 n t ɛ0 tː,6
s i0 n t ɛ0 t,6
s i0 n t eː0 n,6
s i0 n t j eː0 n,7
s i0 n t j eː0 t,7
s i0 n t j ɛ0,6
s i0 n t yː0,5
s i0 n t ʃ ɛ0 m,7
s i0 n t r ɛ0,6
s i0 n t ɑ0,5
s i0 n t i0 m,6
s i0 n t aː0 t,6
s i0 n t øː0,5
s i0 g ɛ0 n,5
s i0 g ɛ0 n t,6
s i0 g ɛ0 t,5
s i0 g ɛ0,4
s i0 l aː0 g,5
s i0 l aː0 r d,6
s i0 ɑ0,3
s i0 k l ɑ0,5
s i0 k l aː0 k,6
s i0 k l aː0 ʃ,6
s i0 k l aː0 t,6
s i0 k l u0 ʃ,6
s i0 k aː0 r,5
s i0 m p l ɑ0,6
s i0 m p l aː0 n,7
s i0 d n i0,5
s ɑ0 b ɑ0 d,5
s ɑ0 b ɑ0,4
s ɑ0 b aː0 j,5
s ɑ0 b aː0 j t,6
s ɑ0 b aː0 r,5
s ɑ0 b aː0 t,5
s ɑ0 b o0 tː,5
s ɑ0 b o0 k,5
s ɑ0 b j ɑ0,5
s ɑ0 v ɑ0 j,5
s ɑ0 v ɑ0 k,5
s ɑ0 v ɑ0 ɟ,5
s ɑ0 v ɑ0,4
s ɑ0 v ɑ0 s,5
s ɑ0 v ɑ0 r,5
s ɑ0 v ɑ0 r t,6
s ɑ0 v ɑ0 t,5
s ɑ0 v ɑ0 ʃ,5
s ɑ0 v ɑ0 zː,5
s ɑ0 v ɑ0 m,5
s ɑ0 v ɑ0 z,5
s ɑ0 v aː0 t,5
s ɑ0 k ɑ0 r,5
s ɑ0 k ɑ0 r t,6
s ɑ0 k ɑ0 r s,6
s ɑ0 k ɑ0 t,5
s ɑ0 k ɑ0 d,5
s ɑ0 k ɑ0 d t,6
s ɑ0 k ɑ0 s,5
s ɑ0 k ɑ0 s t,6
s ɑ0 k ɑ0,4
s ɑ0 k ɑ0 tʃ,5
s ɑ0 k m ɑ0,5
s ɑ0 k o0 tː,5
s ɑ0 k o0 m,5
s ɑ0 k o0 n,5
s ɑ0 k o0 ʃ,5
s ɑ0 k o0 k,5
s ɑ0 l o0 tː,5
s ɑ0 l o0 g,5
s ɑ0 l o0 n,5
s ɑ0 l o0 k,5
s ɑ0 l o0 m,5
s ɑ0 l ɑ0 tː,5
s ɑ0 l ɑ0 p,5
s ɑ0 l ɑ0 d,5
s ɑ0 l ɑ0 d t,6
s ɑ0 l ɑ0 d s,6
s ɑ0 l ɑ0,4
s ɑ0 l ɑ0 k,5
s ɑ0 l ɑ0 t,5
s ɑ0 l ɑ0 n g,6
s ɑ0 l ɑ0 n d,6
s ɑ0 l ɑ0 n t,6
s ɑ0 l ɑ0 ts k,6
s ɑ0 l ɑ0 j,5
s ɑ0 l ɑ0 ʃ,5
s ɑ0 g ɑ0,4
s ɑ0 g ɑ0 m,5
s ɑ0 g ɑ0 ʃ,5
s ɑ0 g ɑ0 ʃ d,6
s ɑ0 g ɑ0 d,5
s ɑ0 g ɑ0 d t,6
s ɛ0 m b ɛ0 n,6
s ɛ0 m b ɛ0 r t,7
s ɛ0 m b ɛ0,5
s ɛ0 m ɛ0,4
s ɛ0 m ɛ0 k,5
s ɛ0 m ɛ0 ʃ,5
s ɛ0 m ɛ0 m,5
s ɛ0 m ɛ0 t,5
s ɛ0 m ɛ0 l t,6
s ɛ0 m ɛ0 l,5
s ɛ0 m ɛ0 n t,6
s ɛ0 m ɛ0 n ʃ,6
s ɛ0 m ɛ0 z,5
s ɛ0 m ɛ0 z t,6
s ɛ0 m ɛ0 d,5
s ɛ0 m ɛ0 ɟ,5
s ɛ0 m eː0 j,5
s ɛ0 m eː0 j t,6
s ɛ0 m eː0 ɲ,5
s ɛ0 m eː0 ɲ t,6
s ɛ0 m eː0 t,5
s ɛ0 m eː0 n,5
s ɛ0 m p l o0 m,7
s ɛ0 m p o0 n t,7
s ɛ0 m p oː0,5
s ɛ0 m y0 n k,6
s ɛ0 m y0 k,5
s ɛ0 m yː0,4
s ɛ0 m t øː0 l,6
s ɛ0 m k ø0 z,6
s ɛ0 m k ø0 z t,7
s ɛ0 g eː0 ɲ,5
s ɛ0 g eː0 ɲ t,6
s ɛ0 g eː0 r,5
s ɛ0 g eː0 r t,6
s ɛ0 g eː0 d,5
s ɛ0 g eː0 l t,6
s ɛ0 g ɛ0 d,5
s ɛ0 g ɛ0 t,5
s ɛ0 g ɛ0 ʃ,5
s ɛ0 g ɛ0 k,5
s ɛ0 g m ɛ0 n t,7
s ɛ0 g m ɛ0 n ʃ,7
s ɛ0 lː ɛ0 tː,5
s ɛ0 lː ɛ0 n,5
s ɛ0 lː ɛ0 n t,6
s ɛ0 lː ɛ0 m,5
s ɛ0 lː ɛ0 g,5
s ɛ0 lː ɛ0,4
s ɛ0 lː øː0,4
s ɛ0 lː øː0 ʃ,5
s ɛ0 lː øː0 l,5
s ɛ0 r d ɑ0,5
s ɛ0 r d aː0 n,6
s ɛ0 r d øː0,5
s ɛ0 r d øː0 k,6
s ɛ0 r d ɛ0,5
s ɛ0 r z øː0,5
s ɛ0 r z øː0 k,6
s ɛ0 r z ɛ0 tː,6
s ɛ0 r ɛ0 k,5
s ɛ0 r ɛ0 t,5
s ɛ0 r ɛ0 t s,6
s ɛ0 r ɛ0 ʃ,5
s ɛ0 r ɛ0,4
s ɛ0 r ɛ0 m,5
s ɛ0 r ɛ0 m t,6
s ɛ0 r ɛ0 d,5
s ɛ0 r ɛ0 d t,6
s ɛ0 r ɛ0 p,5
s ɛ0 r ɛ0 v,5
s ɛ0 r ɛ0 z,5
s ɛ0 r ɛ0 z d,6
s ɛ0 r ɛ0 s t,6
s ɛ0 r ɛ0 l t,6
s ɛ0 r ɛ0 g,5
s ɛ0 r ɛ0 ʃː,5
s ɛ0 r eː0 n,5
s ɛ0 r eː0 k,5
s ɛ0 r eː0 ɲ,5
s ɛ0 r eː0 s t,6
s ɛ0 r eː0 s,5
s ɛ0 r v ɛ0 k,6
s ɛ0 r v ɛ0 ʃ,6
s ɛ0 r v ɛ0 ʃ t,7
s ɛ0 r v ɛ0 t,6
s ɛ0 r v ɛ0 r,6
s ɛ0 r v ɛ0 r t,7
s ɛ0 r v ɛ0,5
s ɛ0 r v ɛ0 z,6
s ɛ0 r v i0 z,6
s ɛ0 r v r ɑ0 j z,8
s ɛ0 r v eː0 t,6
s ɛ0 r v b ɛ0 n,7
s ɛ0 r v b ɛ0,6
s ɛ0 r t ɛ0,5
s ɛ0 r t ɛ0 ʃ,6
s ɛ0 r t ɛ0 m,6
s ɛ0 r t ɛ0 k,6
s ɛ0 r t ɛ0 t,6
s ɛ0 r t b ɛ0 n,7
s ɛ0 r t b ɛ0,6
s ɛ0 r t b øː0 l,7
s ɛ0 r t h o0 ɟ,7
s ɛ0 r t i0,5
s ɛ0 r t eː0 s,6
s ɛ0 r t j ɛ0,6
s ɛ0 r t øː0 z,6
s ɛ0 r s ɛ0,5
s ɛ0 r s aː0 m,6
s ɛ0 r s eː0 ɲ,6
s ɛ0 r b ɛ0 k,6
s ɛ0 mː ɛ0 l,5
s ɛ0 l iː0 d,5
s ɛ0 l ɛ0,4
s ɛ0 l ɛ0 n t,6
s ɛ0 l ɛ0 n,5
s ɛ0 l ɛ0 m,5
s ɛ0 l ɛ0 g,5
s ɛ0 l ɛ0 tː,5
s ɛ0 l ɛ0 d,5
s ɛ0 l ɛ0 k,5
s ɛ0 l ɛ0 l,5
s ɛ0 l ɛ0 l t,6
s ɛ0 l ɛ0 t,5
s ɛ0 l ɛ0 dː,5
s ɛ0 l ɛ0 j t ʃ d,8
s ɛ0 l ɛ0 ʃ,5
s ɛ0 l ɛ0 p,5
s ɛ0 z o0 n,5
s ɛ0 z o0 n t,6
s ɛ0 d n i0,5
s ɛ0 d ɛ0 tː,5
s ɛ0 n t i0,5
s ɛ0 n t i0 ʃ,6
s ɛ0 n t ɛ0 m,6
s ɛ0 n t ɛ0 k,6
s ɛ0 n t ɛ0 ʃ,6
s ɛ0 n t ɛ0 bː,6
s ɛ0 n t eː0 n,6
s ɛ0 n t y0 n k,7
s ɛ0 n t r u0 m,7
s ɛ0 n t ʃ eː0 g,7
s ɛ0 n t øː0 k,6
s ɛ0 n v ɛ0 d,6
s ɛ0 n d s ɛ0 r,7
s ɛ0 n d s ɛ0 r t,8
s ɛ0 n d b ɛ0 n,7
s ɛ0 n d b ɛ0,6
s ɛ0 n d eː0 g,6
s ɛ0 n d ɛ0 ʃ,6
s ɛ0 n d ɛ0 t,6
s ɛ0 n d ɛ0 l t,7
s ɛ0 n d ɛ0 l,6
s ɛ0 n d ɛ0 z,6
s ɛ0 n d øː0 r,6
s ɛ0 n d yː0,5
s ɛ0 n d j ɛ0,6
s ɛ0 n d j eː0 n,7
s ɛ0 n d r ɛ0,6
s ɛ0 n d i0,5
s ɛ0 n d v i0 tʃ,7
s ɛ0 k r eː0 ɲ,6
s ɛ0 k t ɛ0 k,6
s ɛ0 k t ɑ0,5
s oː0 v ɑ0 l,5
s oː0 l oː0,4
s oː0 l oː0 t,5
s oː0 l v ɑ0,5
s oː0 l n i0,5
s oː0 l n ɑ0 k,6
s oː0 l n ɑ0,5
s oː0 l t ɑ0 m,6
s oː0 l t ɑ0 k,6
s oː0 l ɑ0,4
s oː0 l ɑ0 m,5
s oː0 l ɑ0 l t,6
s oː0 l ɑ0 l,5
s oː0 l ɑ0 d,5
s oː0 l j o0 n,6
s oː0 l o0 k,5
s oː0 l u0 k,5
s oː0 l u0 n k,6
s oː0 b ɑ0,4
s oː0 b ɑ0 n,5
s oː0 b oː0 l,5
s oː0 r ɑ0,4
s oː0 n ɑ0 p,5
s oː0 n ɑ0 k,5
s oː0 n ɑ0,4
s oː0 t aː0 r,5
s oː0 h o0 z,5
s y0 k ʃ eː0 g,6
s y0 l øː0 k,5
s y0 l øː0,4
s y0 l eː0 ʃ,5
s y0 l eː0 ʃ t,6
s y0 l eː0 t,5
s y0 l t ɛ0 m,6
s y0 l t ɛ0 k,6
s y0 l t ɛ0,5
s y0 l t y0 n k,7
s y0 l n i0,5
s y0 l n ɛ0 k,6
s y0 r k ɛ0,5
s y0 n ɛ0 t,5
s aː0 m o0 ʃ,5
s aː0 m o0 t,5
s aː0 m o0 n,5
s aː0 m o0 k,5
s aː0 m o0 l,5
s aː0 m o0 l t,6
s aː0 m ɑ0,4
s aː0 m ɑ0 d t,6
s aː0 m ɑ0 d,5
s aː0 m ɑ0 s t,6
s aː0 m iː0 t,5
s aː0 m uː0,4
s aː0 m aː0 t,5
s aː0 m b ɑ0 n,6
s aː0 m b ɑ0,5
s aː0 m b o0 r,6
s aː0 m b o0 r t,7
s aː0 m b aː0 r,6
s aː0 m l aː0 t,6
s aː0 m l ɑ0,5
s aː0 m l ɑ0 p,6
s aː0 z ɑ0 d,5
s aː0 z ɑ0 t,5
s aː0 z ɑ0 k,5
s aː0 z ɑ0,4
s aː0 z ɑ0 m,5
s aː0 z ɑ0 ʃ,5
s aː0 r ɑ0,4
s aː0 r ɑ0 z,5
s aː0 r ɑ0 k,5
s aː0 r ɑ0 d t,6
s aː0 r ɑ0 d,5
s aː0 r ɑ0 t,5
s aː0 r ɑ0 m,5
s aː0 r ɑ0 n,5
s aː0 r ɑ0 s t,6
s aː0 r ɲ eː0 k,6
s aː0 r ɲ ɑ0 ʃ,6
s aː0 r ɲ ɑ0,5
s aː0 r ɲ aː0 t,6
s aː0 j ɑ0,4
s aː0 j ɑ0 k,5
s aː0 j ɑ0 t,5
s aː0 j j ɑ0 l,6
s aː0 j aː0 n,5
s aː0 j aː0 k,5
s aː0 j aː0 t,5
s aː0 lː aː0 ʃ,5
s aː0 lː aː0 ʃ t,6
s aː0 lː aː0 n,5
s aː0 lː aː0 t,5
s aː0 lː n ɑ0 k,6
s aː0 lː n ɑ0,5
s aː0 lː n i0,5
s aː0 lː t ɑ0 k,6
s aː0 lː t ɑ0 m,6
s aː0 lː t u0 n k,7
s aː0 lː iː0 t,5
s aː0 n d eː0 k,6
s aː0 n d o0 r,6
s aː0 n t ɑ0,5
s aː0 n t ɑ0 m,6
s aː0 n t ɑ0 k,6
s aː0 n t j ɑ0,6
s aː0 n t oː0,5
s aː0 n t aː0 k,6
s aː0 n t o0 r,6
s aː0 mː ɑ0 l,5
s aː0 ʒ s o0 r,6
s aː0 l ɑ0 s,5
s aː0 l ɑ0 s t,6
s aː0 l ɑ0 s d,6
s aː0 l ɑ0 m,5
s aː0 l ɑ0,4
s aː0 l ɑ0 d,5
s aː0 l ɑ0 k,5
s aː0 l ɑ0 r ts,6
s eː0 p ɛ0 ʃ,5
s eː0 p ɛ0 ʃ t,6
s eː0 p ɛ0 k,5
s eː0 p ɛ0 n,5
s eː0 p ɛ0 t,5
s eː0 p ɛ0,4
s eː0 p ɛ0 tː,5
s eː0 p ʃ eː0 g,6
s eː0 p n i0,5
s eː0 p n ɛ0 k,6
s eː0 l ɛ0 t,5
s eː0 l ɛ0 k,5
s eː0 l ɛ0 ʃ,5
s eː0 l ɛ0 n,5
s eː0 l ɛ0 m,5
s eː0 l ɛ0 l t,6
s eː0 l eː0 n,5
s eː0 l eː0 n k,6
s eː0 l b ɑ0,5
s eː0 l b oː0 l,6
s eː0 l b ɛ0 n,6
s eː0 l b ɛ0,5
s eː0 l ʃ øː0,5
s eː0 k ɛ0 j,5
s eː0 k ɛ0,4
s eː0 k ɛ0 ʃ,5
s eː0 k ɛ0 n,5
s eː0 k ɛ0 t,5
s eː0 ɟ ɛ0 n,5
s ø0 v ɛ0 g,5
s ø0 v ɛ0 t,5
s ø0 v ɛ0 k,5
s ø0 r ɲ yː0,5
s ø0 r ɲ eː0 k,6
