word,len
k i0 n tʃ ɛ0 t,6
k i0 l ɛ0 n ts,6
k i0 l oː0,4
k i0 l oː0 ʃ,5
k i0 l oː0 t,5
k i0 m ɛ0 n t,6
k i0 m ɛ0 ɟ,5
k i0 z aː0 r t,6
k i0 z aː0 j n,6
k i0 v ɛ0 l,5
k i0 v aː0 t,5
k i0 v aː0 l t,6
k i0 k i0,4
k i0 k n ɛ0 k,6
k i0 k n i0 k,6
k i0 k ɛ0 r,5
k i0 k ɛ0 r t,6
k i0 k ɛ0 t,5
k i0 aː0 l t,5
k i0 aː0 lː t,5
k i0 aː0 lː,4
k i0 eː0,3
k i0 s aː0 lː t,6
k i0 j ø0 tː,5
k i0 j ø0 n,5
k i0 t ɑ0,4
k i0 t ɑ0 l,5
k i0 t ɑ0 l t,6
k i0 t ɑ0 r t,6
k i0 t ø0 r t,6
k i0 t ɛ0 t,5
k i0 t ɛ0 r,5
k i0 t ɛ0,4
k i0 t ɛ0 l t,6
k i0 t ɛ0 ʃ,5
k i0 t ɛ0 tː,5
k i0 h ɑ0 r,5
k i0 h ɑ0 l t,6
k i0 h ɛ0 j t,6
k i0 h ɛ0 z,5
k i0 h ɛ0 n t,6
k i0 ɲ iː0 l t,6
k i0 ɛ0 ʃ,4
k i0 iː0 r t,5
k ø0 z b ɛ0 n,6
k ø0 z b ɛ0,5
k ø0 z y0 l,5
k ø0 z y0 k,5
k ø0 z ø0 ʃ,5
k ø0 z ø0 l t,6
k ø0 z ø0 l,5
k ø0 z ø0 m,5
k ø0 z eː0,4
k ø0 z eː0 p,5
k ø0 z eː0 n k,6
k ø0 z ɛ0 l,5
k ø0 z ɛ0,4
k ø0 z ɛ0 g,5
k ø0 z t y0 k,6
k ø0 z t y0 n k,7
k ø0 z t i0,5
k ø0 z t ɛ0 ʃ,6
k ø0 z p o0 n t,7
k ø0 z l eː0 ʃ,6
k ø0 z l eː0 ʃ t,7
k ø0 z l i0,5
k ø0 z l i0 k,6
k ø0 z l ø0 m,6
k ø0 z l øː0,5
k ø0 z uː0 t,5
k ø0 z r ɛ0,5
k ø0 z h ɛ0 j,6
k ø0 r y0 l,5
k ø0 r y0 l t,6
k ø0 r y0 l s,6
k ø0 r b ɛ0 n,6
k ø0 r b ɛ0,5
k ø0 r eː0,4
k ø0 r yː0,4
k ø0 r ɛ0 g,5
k ø0 r ɛ0,4
k ø0 r ɲ yː0,5
k ø0 r ɲ eː0 k,6
k ø0 r ɲ ɛ0 k,6
k ø0 r ø0 g,5
k ø0 r ø0 k,5
k ø0 r ø0 ʃ,5
k ø0 r ø0 m,5
k ø0 r ø0 n,5
k ø0 r ø0 l t,6
k ø0 r ø0 tː,5
k ø0 r uː0 t,5
k ø0 r k eː0 p,6
k ø0 ɲː ɛ0 n,5
k ø0 ɲː ɛ0 bː,5
k ø0 ɲː ɛ0 d,5
k ø0 ɲː ɛ0 t,5
k ø0 ɲː yː0,4
k ø0 l t øː0,5
k ø0 l t øː0 k,6
k ø0 l t øː0 t,6
k ø0 l t ø0 tː,6
k ø0 l t ø0 m,6
k ø0 l t i0,5
k ø0 l t i0 k,6
k ø0 l t ʃ ɛ0,6
k ø0 l t ʃ eː0 g,7
k ø0 l t ɛ0,5
k ø0 l t ɛ0 k,6
k ø0 l t j y0 k,7
k ø0 l tʃ ɛ0 k,6
k ø0 l tʃ ɛ0 n,6
k ø0 l tʃ ɛ0 bː,6
k ø0 l tʃ ø0 n,6
k ø0 ɲ v ɛ0 t,6
k ø0 ɲ v ɛ0,5
k ø0 ɲ v ɛ0 k,6
k ø0 ɲ v ɛ0 m,6
k ø0 ɲ v ɛ0 ʃ,6
k ø0 ɲ v eː0 t,6
k ø0 ɲ v t aː0 r,7
k ø0 ɲ v b ɛ0 n,7
k ø0 ɲ v b øː0 l,7
k ø0 ɲ v n ɛ0 k,7
k ø0 ɲ v r øː0 l,7
k ø0 t ø0 tː,5
k ø0 t ɛ0 t,5
k ø0 t n i0,5
k ø0 t n ɛ0 k,6
k ø0 t i0,4
k ø0 t i0 k,5
k ø0 t v ɛ0 n,6
k ø0 t v ɛ0,5
k ø0 t eː0 t,5
k ø0 t eː0 l,5
k ø0 s i0,4
k ø0 s ø0 n t,6
k ø0 v ɛ0 g,5
k ø0 v ɛ0 t,5
k ø0 v ɛ0 k,5
k ø0 v eː0,4
k ø0 v eː0 ɲ,5
k ø0 v eː0 ɲ t,6
k ø0 v eː0 r,5
k ø0 v eː0 k,5
k ø0 v eː0 ʃ,5
k ø0 zː eː0,4
k ø0 tʃ ø0 g,5
k ø0 d ø0 r,5
k ø0 d ø0 ʃ,5
k ø0 j ø0 k,5
k ø0 ʒ eː0 g,5
k eː0 ʃ øː0 bː,5
k eː0 ʃ øː0,4
k eː0 ʃ øː0 n,5
k eː0 ʃ i0 k,5
k eː0 ʃ ɛ0 n,5
k eː0 ʃ ɛ0 tː,5
k eː0 p ɛ0 ʃ,5
k eː0 p ɛ0 ʃ t,6
k eː0 p ɛ0 k,5
k eː0 p ɛ0 n,5
k eː0 p ɛ0 t,5
k eː0 p ɛ0,4
k eː0 p ɛ0 tː,5
k eː0 p z eː0 ʃ,6
k eː0 p z eː0 ʃ t,7
k eː0 p z ɛ0 l d,7
k eː0 p z ɛ0 l,6
k eː0 p z ɛ0 l t,7
k eː0 p z ɛ0 tː,6
k eː0 p z øː0,5
k eː0 p eː0 ʃ t,6
k eː0 p eː0 ʃ,5
k eː0 p eː0 t,5
k eː0 p i0,4
k eː0 p r ɛ0,5
k eː0 p r øː0 l,6
k eː0 p b ɛ0 n,6
k eː0 p b ɛ0,5
k eː0 p l ɛ0 t,6
k eː0 r d eː0 ʃ,6
k eː0 r d eː0 ʃ t,7
k eː0 r d ɛ0 k,6
k eː0 r d ɛ0 z d,7
k eː0 r d ɛ0 z,6
k eː0 r d ɛ0 m,6
k eː0 r d r ɛ0,6
k eː0 r d i0,5
k eː0 r ɛ0 m,5
k eː0 r ɛ0 n,5
k eː0 r ɛ0 k,5
k eː0 r ɛ0 ʃ,5
k eː0 r ɛ0 z,5
k eː0 r ɛ0 tː,5
k eː0 r ɛ0 g,5
k eː0 r ɛ0 t,5
k eː0 r ɛ0,4
k eː0 r ɛ0 l t,6
k eː0 r t ɛ0 m,6
k eː0 r t ɛ0,5
k eː0 r t ɛ0 k,6
k eː0 r t ɛ0 d,6
k eː0 r t ɛ0 tː,6
k eː0 r t ɛ0 s,6
k eː0 r t eː0 k,6
k eː0 r t i0,5
k eː0 r t i0 k,6
k eː0 r t y0 n k,7
k eː0 r t y0 k,6
k eː0 r t j y0 k,7
k eː0 r t øː0,5
k eː0 r t ʃ ɛ0,6
k eː0 r n i0,5
k eː0 r n ɛ0 k,6
k eː0 r n ɛ0,5
k eː0 r n ø0 k,6
k eː0 r j ɛ0,5
k eː0 r j ɛ0 m,6
k eː0 r j ɛ0 n,6
k eː0 r j y0 k,6
k eː0 r j y0 n k,7
k eː0 r j h ɛ0 z,7
k eː0 r j eː0 t,6
k eː0 r l ɛ0 k,6
k eː0 r l ɛ0 g,6
k eː0 r i0,4
k eː0 r i0 n t,6
k eː0 r i0 k,5
k eː0 r y0 n k,6
k eː0 r y0 l t,6
k eː0 r eː0 ʃ,5
k eː0 r eː0 ʃ t,6
k eː0 r eː0 t,5
k eː0 s y0 l t,6
k eː0 s y0 l,5
k eː0 s y0 k,5
k eː0 s y0 n k,6
k eː0 s ɛ0,4
k eː0 s ɛ0 n,5
k eː0 s ɛ0 g,5
k eː0 s ɛ0 k,5
k eː0 s ɛ0 m,5
k eː0 s iː0 t,5
k eː0 s iː0 t ʃ,6
k eː0 s r ɛ0,5
k eː0 s r øː0 l,6
k eː0 s t ɑ0,5
k eː0 s t aː0 t,6
k eː0 s t ɛ0 t,6
k eː0 s ʒ eː0 g,6
k eː0 s l ɛ0 t,6
k eː0 n ɛ0,4
k eː0 n ɛ0 k,5
k eː0 n ɛ0 m,5
k eː0 t s ɛ0 r,6
k eː0 t s aː0 z,6
k eː0 t s aː0 m,6
k eː0 t ʃ eː0 g,6
k eː0 t ɛ0 n,5
k eː0 t ɛ0 l,5
k eː0 t ɛ0 l t,6
k eː0 t ɛ0 r,5
k eː0 t ɛ0 r t,6
k eː0 t ɛ0,4
k eː0 t ɛ0 g,5
k eː0 t ɛ0 ʃ,5
k eː0 t ɛ0 j,5
k eː0 t ɛ0 t,5
k eː0 zː ɛ0 l,5
k eː0 zː ɛ0,4
k eː0 zː ɛ0 n,5
k eː0 z b ɛ0 n,6
k eː0 z b ɛ0,5
k eː0 z b øː0 l,6
k eː0 z r ɛ0,5
k eː0 z i0,4
k eː0 z i0 k,5
k eː0 z h ɛ0 z,6
k eː0 z n i0,5
k eː0 z n ɛ0 k,6
k eː0 z n ɛ0 m,6
k eː0 z n eː0 l,6
k eː0 z ɛ0 tː,5
k eː0 z ɛ0 m,5
k eː0 z ɛ0 k,5
k eː0 z ɛ0 t,5
k eː0 z ɛ0 l d,6
k eː0 z ɛ0 l,5
k eː0 z ɛ0 l t,6
k eː0 z ɛ0 n,5
k eː0 ɲ s ɛ0 r,6
k eː0 ɲ ɛ0 g,5
k eː0 ɲ ɛ0 ʃ,5
k eː0 ɲ ɛ0 k,5
k eː0 ɲ ɛ0,4
k eː0 pː ɛ0 n,5
k eː0 pː ɛ0 l,5
k eː0 ʃː ɛ0 l,5
k eː0 k ɛ0 j,5
k eː0 k ɛ0,4
k eː0 k ɛ0 ʃ,5
k eː0 k ɛ0 n,5
k eː0 k ɛ0 t,5
k iː0 v y0 l,5
k iː0 v y0 n k,6
k iː0 v y0 k,5
k iː0 v aː0 n,5
k iː0 v aː0 n t,6
k iː0 v aː0 n s,6
k iː0 n o0 ʃ,5
k iː0 n aː0 l,5
k iː0 n aː0 l t,6
k iː0 ɟ oː0,4
k iː0 ɟ oː0 t,5
k iː0 ʃ eː0 r t,6
k ɑ0 p o0 tː,5
k ɑ0 p o0 n,5
k ɑ0 p o0 t,5
k ɑ0 p o0 k,5
k ɑ0 p o0 ʃ,5
k ɑ0 p o0 m,5
k ɑ0 p t ɑ0 m,6
k ɑ0 p t ɑ0,5
k ɑ0 p t ɑ0 k,6
k ɑ0 p t u0 n k,7
k ɑ0 p t u0 k,6
k ɑ0 p t aː0 r,6
k ɑ0 p t aː0 r t,7
k ɑ0 p t aː0 k,6
k ɑ0 p t aː0 l,6
k ɑ0 p t oː0 l,6
k ɑ0 p t o0 p,6
k ɑ0 p tʃ aː0 n,6
k ɑ0 p n i0,5
k ɑ0 p n ɑ0 k,6
k ɑ0 p n aː0 l t,7
k ɑ0 p n aː0 l,6
k ɑ0 p n aː0 l d,7
k ɑ0 p n aː0 l s,7
k ɑ0 p n aː0 l j,7
k ɑ0 p u0,4
k ɑ0 p u0 n k,6
k ɑ0 p u0 ʃ,5
k ɑ0 p u0 t,5
k ɑ0 p j ɑ0,5
k ɑ0 p j aː0 n,6
k ɑ0 p j aː0 n l,7
k ɑ0 p j aː0 t,6
k ɑ0 p j aː0 k,6
k ɑ0 p j u0 k,6
k ɑ0 p j o0 n,6
k ɑ0 p h ɑ0 t,6
k ɑ0 p ʒ i0,5
k ɑ0 m p aː0 ɲ,6
k ɑ0 m p aː0 ɲ t,7
k ɑ0 m u0,4
k ɑ0 m ɑ0 r,5
k ɑ0 m ɑ0,4
k ɑ0 m ɑ0 z,5
k ɑ0 m ɑ0 t,5
k ɑ0 r j aː0 t,6
k ɑ0 r j ɑ0,5
k ɑ0 r d o0 t,6
k ɑ0 r dː ɑ0 l,6
k ɑ0 r b aː0 r,6
k ɑ0 r b ɑ0 n,6
k ɑ0 r m i0 n t,7
k ɑ0 r m i0 n t ʃ,8
k ɑ0 r m i0 n,6
k ɑ0 r m i0 n ts,7
k ɑ0 r m ɑ0,5
k ɑ0 r tʃ uː0,5
k ɑ0 r o0 m,5
k ɑ0 r o0 k,5
k ɑ0 l ɑ0 tː,5
k ɑ0 l ɑ0 p,5
k ɑ0 l ɑ0 d,5
k ɑ0 l ɑ0 d t,6
k ɑ0 l ɑ0 d s,6
k ɑ0 l ɑ0,4
k ɑ0 l ɑ0 k,5
k ɑ0 l ɑ0 t,5
k ɑ0 l ɑ0 n g,6
k ɑ0 l ɑ0 n d,6
k ɑ0 l ɑ0 n t,6
k ɑ0 l ɑ0 ts k,6
k ɑ0 l ɑ0 j,5
k ɑ0 l ɑ0 ʃ,5
k ɑ0 j ɑ0,4
k ɑ0 j ɑ0 t,5
k ɑ0 j aː0 t,5
k ɑ0 j aː0 n,5
k ɑ0 j aː0 n l,6
k ɑ0 b aː0 j,5
k ɑ0 b aː0 j t,6
k ɑ0 b aː0 r,5
k ɑ0 b aː0 t,5
k ɑ0 tː i0 n t,6
k ɑ0 tː i0 n t ʃ,7
k ɑ0 rː ɑ0 l,5
k ɑ0 v i0,4
k ɑ0 v i0 tʃ,5
k ɑ0 n aː0 r,5
k ɑ0 n aː0 tʃ,5
k ɑ0 n aː0 n t,6
k ɑ0 n aː0 l t,6
k ɑ0 n aː0 l,5
k ɑ0 n aː0 l d,6
k ɑ0 n aː0 l s,6
k ɑ0 n aː0 l j,6
k ɑ0 n aː0,4
k o0 r m aː0 ɲ,6
k o0 r m aː0 ɲ t,7
k o0 r m aː0 k,6
k o0 r m aː0 t,6
k o0 r m aː0 l,6
k o0 r m ɑ0,5
k o0 r ɑ0,4
k o0 r aː0 n,5
k o0 r aː0 t,5
k o0 r aː0 l,5
k o0 r aː0 s,5
k o0 r b ɑ0 n,6
k o0 r b ɑ0,5
k o0 r s aː0 g,6
k o0 r s ɑ0 k,6
k o0 r u0 n k,6
k o0 r u0 l,5
k o0 r u0 l t,6
k o0 r o0 s,5
k o0 r o0 ʃ,5
k o0 r o0 n,5
k o0 r o0 g,5
k o0 r o0 k,5
k o0 r o0 ɲ,5
k o0 r o0 ɲ t,6
k o0 r t aː0 l,6
k o0 r t aː0 n,6
k o0 r t o0 k,6
k o0 r t ɑ0,5
k o0 r t oː0 l,6
k o0 r t r eː0,6
k o0 r uː0,4
k o0 r i0 n t,6
k o0 r i0,4
k o0 r i0 t,5
k o0 r i0 g,5
k o0 r i0 k,5
k o0 m o0 j,5
k o0 m o0 n,5
k o0 m o0,4
k o0 m o0 r,5
k o0 m o0 k,5
k o0 m o0 t,5
k o0 m o0 tː,5
k o0 m p aː0 ʃ,6
k o0 m p ɑ0,5
k o0 m p l ɛ0 tː,7
k o0 m tʃ i0,5
k o0 n k r eː0 t,7
k o0 n k ɑ0,5
k o0 n k aː0 t,6
k o0 n ts ɛ0 r t,7
k o0 n t o0 ʃ,6
k o0 n t o0 n,6
k o0 n t o0 tː,6
k o0 n t o0 t,6
k o0 n t o0 k,6
k o0 n t aː0 n,6
k o0 n t aː0 k,6
k o0 n t aː0 ʃ,6
k o0 n t ɑ0,5
k o0 n t b ɑ0 n,7
k o0 n t b ɑ0,6
k o0 n t j ɑ0,6
k o0 n t j aː0 n,7
k o0 n t j aː0 k,7
k o0 n t r o0 lː,7
k o0 n t r ɑ0,6
k o0 n t i0,5
k o0 n z oː0,5
k o0 n z o0 tː,6
k o0 n z o0 l,6
k o0 tʃ i0,4
k o0 tʃ i0 t,5
k o0 tʃ i0 ʃ,5
k o0 tʃ i0 k,5
k o0 tʃ m ɑ0,5
k o0 v aː0 bː,5
k o0 v aː0 tʃ,5
k o0 v aː0 k,5
k o0 v aː0,4
k o0 v aː0 ɲ,5
k o0 v aː0 t,5
k o0 ɲ h ɑ0,5
k o0 ɲ h aː0 t,6
k o0 rː ɛ0 k t,6
k o0 rː ɛ0 n d,6
k o0 rː u0 p t,6
k o0 l b aː0 s,6
k o0 l d ɑ0 l,6
k o0 l d ɑ0 l t,7
k o0 l d ɑ0 t,6
k o0 l d o0 g,6
k o0 l d j ɑ0,6
k o0 l d j ɑ0 m,7
k o0 l d j ɑ0 k,7
k o0 l d j aː0 k,7
k o0 l d u0 ʃ,6
k o0 ts k ɑ0,5
k o0 ts k aː0 ʃ,6
k o0 ts k aː0 ʃ t,7
k o0 ʃ aː0 r,5
k o0 p ɑ0 s,5
k o0 p aː0 ʃ,5
k o0 p aː0 r,5
k o0 p o0 r t,6
k o0 p o0 tː,5
k o0 s o0 ʃ,5
k o0 z m o0 s,6
k y0 l ø0 n,5
k y0 l ø0 n ts,6
k y0 l ø0 k,5
k y0 l ʃ øː0,5
k y0 l d ø0 tː,6
k y0 l d ø0 k,6
k y0 l d ø0 m,6
k y0 l d t ɛ0,6
k y0 l d t ɛ0 k,7
k y0 l d t ɛ0 m,7
k y0 l d eː0 ʃ,6
k y0 l d i0,5
k y0 l d i0 k,6
k y0 l d j ɛ0,6
k y0 l f ø0 l d,7
k y0 c y0,4
k y0 s ø0 b,5
k y0 z d øː0,5
k y0 z d ø0 tː,6
k u0 c ɑ0,4
k u0 c aː0 k,5
k u0 c aː0 t,5
k u0 r v ɑ0,5
k u0 r v aː0 n,6
k u0 r v aː0 bː,6
k u0 r z u0 ʃ,6
k u0 r u0 n k,6
k u0 r u0 ts,5
k u0 l tʃ ɑ0,5
k u0 l tʃ o0 t,6
k u0 l tʃ aː0 t,6
k u0 k ɑ0 ts,5
k u0 p o0 n,5
k u0 d ɑ0 t,5
k u0 d ɑ0 r ts,6
k u0 s k u0 s,6
k u0 t ɑ0 t,5
k u0 t ɑ0 l,5
k u0 t ɑ0 l t,6
k u0 t ɑ0 k,5
k u0 t ɑ0 ʃ,5
k u0 t ɑ0 ʃ d,6
k u0 t ɑ0,4
k u0 t ɑ0 m,5
k aː0 v eː0,4
k aː0 v eː0 t,5
k aː0 v eː0 ʃ,5
k aː0 r o0 m,5
k aː0 r o0 ʃ,5
k aː0 r o0 ʃ t,6
k aː0 r o0 n,5
k aː0 r o0 k,5
k aː0 r o0 l t,6
k aː0 r c ɑ0,5
k aː0 r c aː0 t,6
k aː0 o0 s,4
k aː0 b eː0,4
k aː0 b ɛ0 l,5
k aː0 p l aː0 r,6
k aː0 p l aː0 l t,7
k aː0 d b ɑ0 n,6
k aː0 n t ɑ0,5
k aː0 n t ɑ0 m,6
k aː0 n t ɑ0 k,6
k aː0 n t j ɑ0,6
k aː0 n t oː0,5
k aː0 n t aː0 k,6
k aː0 n t o0 r,6
k oː0 r h aː0 z,6
k oː0 d o0 n,5
k oː0 d o0 t,5
k oː0 d o0 k,5
k oː0 b o0 r,5
k r u0 m p l i0,7
k r i0 m i0,5
k r eː0 m l ɛ0 tː,7
k r eː0 m l i0 k,7
k r eː0 m ɛ0 t,6
k r eː0 m ɛ0 j,6
k r eː0 m ɛ0 ʃ,6
k r iː0 z i0,5
k r iː0 z i0 k,6
k r iː0 z i0 ʃ,6
k øː0 b øː0 l,5
k l u0 bː ɑ0 n,6
k l i0 p b ɛ0 n,7
k v aː0 z i0,5
k v aː0 z i0 ʃ,6
k v aː0 z ɑ0 d,6
k v aː0 z ɑ0 t,6
k v aː0 z ɑ0 k,6
k v aː0 z ɑ0,5
k v aː0 z ɑ0 m,6
k v aː0 z ɑ0 ʃ,6
k v aː0 z r oː0 l,7
k v aː0 z r ɑ0,6
k v ɑ0 z aː0 n k,7
k v ɑ0 z aː0 n,6
k v ɑ0 z aː0 r,6
k uː0 s o0 tː,5
b ɛ0 nː ɛ0,4
b ɛ0 nː ɛ0 k,5
b ɛ0 nː ɛ0 m,5
b ɛ0 nː ɛ0 d,5
b ɛ0 nː y0 k,5
b ɛ0 nː y0 n k,6
b ɛ0 l ɛ0,4
b ɛ0 l ɛ0 n t,6
b ɛ0 l ɛ0 n,5
b ɛ0 l ɛ0 m,5
b ɛ0 l ɛ0 g,5
b ɛ0 l ɛ0 tː,5
b ɛ0 l ɛ0 d,5
b ɛ0 l ɛ0 k,5
b ɛ0 l ɛ0 l,5
b ɛ0 l ɛ0 l t,6
b ɛ0 l ɛ0 t,5
b ɛ0 l ɛ0 dː,5
b ɛ0 l ɛ0 j t ʃ d,8
b ɛ0 l ɛ0 ʃ,5
b ɛ0 l ɛ0 p,5
b ɛ0 l y0 l,5
b ɛ0 l y0 k,5
b ɛ0 l y0 n k,6
b ɛ0 l ʃ øː0,5
b ɛ0 l ʃ øː0 bː,6
b ɛ0 l ʃ øː0 k,6
b ɛ0 l ʃ øː0 t,6
b ɛ0 l g ɑ0,5
b ɛ0 l eː0 g,5
b ɛ0 l eː0,4
b ɛ0 l eː0 t,5
b ɛ0 l eː0 m,5
b ɛ0 l eː0 r t,6
b ɛ0 l eː0 n k,6
b ɛ0 l eː0 n,5
b ɛ0 l eː0 p,5
b ɛ0 l j ɛ0 ʃ,6
b ɛ0 l j ɛ0 bː,6
b ɛ0 l j ø0 tː,6
b ɛ0 l j ø0 n,6
b ɛ0 l j u0 t,6
b ɛ0 s eː0 l,5
b ɛ0 s eː0 l t,6
b ɛ0 s eː0 l s,6
b ɛ0 s eː0 l j,6
b ɛ0 s eː0 d,5
b ɛ0 s eː0 j t,6
b ɛ0 s eː0 j,5
b ɛ0 s ɛ0 k,5
b ɛ0 s ɛ0 m,5
b ɛ0 s ɛ0 l,5
b ɛ0 s ɛ0 l t,6
b ɛ0 s ɛ0 d,5
b ɛ0 s ɛ0 tː,5
b ɛ0 s ɛ0,4
b ɛ0 t ɛ0 g,5
b ɛ0 t ɛ0 tː,5
b ɛ0 t ɛ0,4
b ɛ0 t ɛ0 t,5
b ɛ0 t ɛ0 ʃ,5
b ɛ0 t ɛ0 k,5
b ɛ0 t ɛ0 n,5
b ɛ0 t ɛ0 m,5
b ɛ0 t yː0,4
b ɛ0 t yː0 ʃ,5
b ɛ0 t yː0 k,5
b ɛ0 t yː0 t,5
b ɛ0 t yː0 n t,6
b ɛ0 t o0 n,5
b ɛ0 v aː0 l t,6
b ɛ0 v ɛ0,4
b ɛ0 v ɛ0 t,5
b ɛ0 v ɛ0 ʃ,5
b ɛ0 v ɛ0 ʃ t,6
b ɛ0 v ɛ0 l t,6
b ɛ0 v ɛ0 l,5
b ɛ0 v ɛ0 z,5
b ɛ0 v ɛ0 tː,5
b ɛ0 v ɛ0 k,5
b ɛ0 v ɛ0 d,5
b ɛ0 v ɛ0 r,5
b ɛ0 v ɛ0 r t,6
b ɛ0 v ɛ0 m,5
b ɛ0 n z i0 n,6
b ɛ0 n ʃ øː0,5
b ɛ0 j ø0 tː,5
b ɛ0 j ø0 n,5
b ɛ0 zː ɛ0 l,5
b ɛ0 zː ɛ0 g,5
b ɛ0 m ɛ0,4
b ɛ0 m ɛ0 k,5
b ɛ0 m ɛ0 ʃ,5
b ɛ0 m ɛ0 m,5
b ɛ0 m ɛ0 t,5
b ɛ0 m ɛ0 l t,6
b ɛ0 m ɛ0 l,5
b ɛ0 m ɛ0 n t,6
b ɛ0 m ɛ0 n ʃ,6
b ɛ0 m ɛ0 z,5
b ɛ0 m ɛ0 z t,6
b ɛ0 m ɛ0 d,5
b ɛ0 m ɛ0 ɟ,5
b ɛ0 z aː0 r,5
b ɛ0 z aː0 r t,6
b ɛ0 tʃ ɛ0 ʃ,5
b ɛ0 tʃ ɛ0 t,5
b ɛ0 aː0 lː t,5
b i0 z t o0 ʃ,6
b i0 z o0 ɲ,5
b i0 z ɑ0 rː,5
b i0 z n i0 s,6
b i0 k ɑ0,4
b i0 t ɛ0 t,5
b i0 t ɛ0 r,5
b i0 t ɛ0,4
b i0 t ɛ0 l t,6
b i0 t ɛ0 ʃ,5
b i0 t ɛ0 tː,5
b i0 r t o0 k,6
b o0 l d ɑ0 l,6
b o0 l d ɑ0 l t,7
b o0 l d ɑ0 t,6
b o0 l d o0 g,6
b o0 l d j ɑ0,6
b o0 l d j ɑ0 m,7
b o0 l d j ɑ0 k,7
b o0 l d j aː0 k,7
b o0 l d u0 ʃ,6
b o0 l g o0 k,6
b o0 l g o0 t,6
b o0 l g o0 m,6
b o0 l g o0 n,6
b o0 l g o0 d,6
b o0 l g ɑ0,5
b o0 l g aː0 l,6
b o0 l g aː0 l t,7
b o0 l g aː0 r,6
b o0 l g aː0 t,6
b o0 l g aː0 k,6
b o0 l g u0 n k,7
b o0 l g u0 k,6
b o0 l o0 g,5
b o0 l o0 tː,5
b o0 l o0 n d,6
b o0 l t ɑ0 k,6
b o0 l t ɑ0 m,6
b o0 l t ɑ0 n,6
b o0 l t ɑ0,5
b o0 l t u0 n k,7
b o0 l t aː0 l,6
b o0 l t aː0 ʃ,6
b o0 l t aː0 t,6
b o0 l t aː0 r,6
b o0 l t b ɑ0 n,7
b o0 l t b ɑ0,6
b o0 l t o0 k,6
b o0 l t o0 t,6
b o0 l t j ɑ0,6
b o0 l t i0,5
b o0 n t o0 ʃ,6
b o0 n t o0 n,6
b o0 n t o0 tː,6
b o0 n t o0 t,6
b o0 n t o0 k,6
b o0 n t aː0 n,6
b o0 n t aː0 k,6
b o0 n t aː0 ʃ,6
b o0 n t ɑ0,5
b o0 n t b ɑ0 n,7
b o0 n t b ɑ0,6
b o0 n t j ɑ0,6
b o0 n t j aː0 n,7
b o0 n t j aː0 k,7
b o0 n t r o0 lː,7
b o0 n t r ɑ0,6
b o0 n t i0,5
b o0 ts i0,4
b o0 sː uː0,4
b o0 sː uː0 t,5
b o0 t r aː0 k,6
b o0 t r aː0 ɲ,6
b o0 r ɑ0,4
b o0 r u0 n k,6
b o0 r u0 l,5
b o0 r u0 l t,6
b o0 r o0 s,5
b o0 r o0 ʃ,5
b o0 r o0 n,5
b o0 r o0 g,5
b o0 r o0 k,5
b o0 r o0 ɲ,5
b o0 r o0 ɲ t,6
b o0 r ʃ ɑ0 n,6
b o0 r ʃ ɑ0,5
b o0 r ʃ ɑ0 bː,6
b o0 r ʃ aː0 t,6
b o0 r ʃ o0 ʃ,6
b o0 r ʃ o0 t,6
b o0 r ʃ u0 k,6
b o0 r ʃ uː0,5
b o0 r aː0 n,5
b o0 r aː0 t,5
b o0 r aː0 l,5
b o0 r aː0 s,5
b o0 j g oː0,5
b o0 j g oː0 n,6
b o0 j g oː0 k,6
b o0 tʃ aː0 ʃː,5
b o0 h oː0 ts,5
b o0 h oː0,4
b o0 z oː0 t,5
b o0 z oː0,4
b o0 k r ɑ0,5
b o0 k r o0 k,6
b o0 k o0 tː,5
b o0 k o0 ʃ,5
b o0 k o0 z,5
b o0 k o0 l,5
b o0 k o0 k,5
b o0 k o0 t,5
b o0 k o0 n,5
b o0 k o0 m,5
b o0 k o0 r,5
b o0 m b ɑ0 t,6
b o0 m b ɑ0 n,6
b o0 m b ɑ0,5
b o0 m b o0 t,6
b o0 m b r ɑ0,6
b o0 rː ɑ0,4
b o0 rː ɑ0 l,5
b aː0 r k i0,5
b aː0 r k i0 t,6
b aː0 r k ɑ0,5
b aː0 r k aː0 ɲ,6
b aː0 r k aː0 t,6
b aː0 r m i0,5
b aː0 r m i0 t,6
b aː0 r m i0 n t,7
b aː0 r m i0 j,6
b aː0 r m ɛ0 j,6
b aː0 r m aː0 r,6
b aː0 r m ɑ0 n,6
b aː0 r m ɑ0 ʃ,6
b aː0 r m ɑ0 t,6
b aː0 r m yː0,5
b aː0 r h o0 l,6
b aː0 r h o0 ɟ,6
b aː0 r h ɑ0 t,6
b aː0 r h ɑ0,5
b aː0 r oː0,4
b aː0 r tʃ ɑ0 k,6
b aː0 r aː0 n,5
b aː0 r aː0 t,5
b aː0 r aː0 ʃ,5
b aː0 r aː0 ɲ,5
b aː0 r aː0 ɲ t,6
b aː0 t r ɑ0 n,6
b aː0 t r ɑ0,5
b aː0 t r aː0 l t,7
b aː0 t r aː0 ɲ,6
b aː0 t r aː0 ɲ t,7
b aː0 t o0 m,5
b aː0 t o0 tː,5
b aː0 t o0 k,5
b aː0 t o0 r,5
b aː0 t o0 d,5
b aː0 tʃ i0,4
b aː0 tʃ i0 t,5
b aː0 j o0 ʃ,5
b aː0 j o0 n,5
b aː0 n ɑ0 t,5
b aː0 n ɑ0 k,5
b aː0 n i0 k,5
b aː0 n i0 t,5
b aː0 n t ɑ0,5
b aː0 n t ɑ0 m,6
b aː0 n t ɑ0 k,6
b aː0 n t j ɑ0,6
b aː0 n t oː0,5
b aː0 n t aː0 k,6
b aː0 n t o0 r,6
b aː0 n o0 m,5
b aː0 nː i0,4
b aː0 nː ɑ0 k,5
b aː0 c aː0 m,5
b aː0 m u0 l t,6
b aː0 b ɑ0,4
b aː0 b ɑ0 m,5
b aː0 ɟ ɑ0,4
b aː0 ɟ ɑ0 k,5
b aː0 ɟ ɑ0 t,5
b aː0 ɟ ɑ0 d t,6
b aː0 ɟ ɑ0 n,5
b aː0 z i0,4
b aː0 z i0 ʃ,5
b r i0 n g aː0 ʃ,7
b r i0 n g aː0 t,7
b r i0 n g ɑ0,6
b r ɑ0 z i0 l,6
b r u0 tː oː0,5
b eː0 k ɛ0 j,5
b eː0 k ɛ0,4
b eː0 k ɛ0 ʃ,5
b eː0 k ɛ0 n,5
b eː0 k ɛ0 t,5
b eː0 k eː0 ʃ,5
b eː0 k eː0 t,5
b eː0 k eː0 n,5
b eː0 k eː0 n t,6
b eː0 tʃ i0,4
b eː0 n ɑ0,4
b eː0 r ɛ0 m,5
b eː0 r ɛ0 n,5
b eː0 r ɛ0 k,5
b eː0 r ɛ0 ʃ,5
b eː0 r ɛ0 z,5
b eː0 r ɛ0 tː,5
b eː0 r ɛ0 g,5
b eː0 r ɛ0 t,5
b eː0 r ɛ0,4
b eː0 r ɛ0 l t,6
b eː0 r b ɛ0 n,6
b eː0 r b ɛ0,5
b eː0 t ɑ0,4
b eː0 l ɛ0 t,5
b eː0 l ɛ0 k,5
b eː0 l ɛ0 ʃ,5
b eː0 l ɛ0 n,5
b eː0 l ɛ0 m,5
b eː0 l ɛ0 l t,6
b iː0 r oː0,4
b iː0 r oː0 k,5
b iː0 r oː0 t,5
b iː0 r j ɑ0,5
b iː0 r j ɑ0 k,6
b iː0 r j aː0 k,6
b iː0 r j o0 n,6
b iː0 r j u0 k,6
b iː0 r t ɑ0,5
b iː0 r t ɑ0 m,6
b iː0 r t ɑ0 k,6
b iː0 r t ɑ0 d,6
b iː0 r t aː0 k,6
b iː0 r t aː0 l,6
b iː0 r t u0 n k,7
b iː0 r t u0 k,6
b iː0 r o0 k,5
b iː0 r o0 m,5
b iː0 r o0 tː,5
b iː0 r o0 d,5
b iː0 r n i0,5
b iː0 r n ɑ0 k,6
b iː0 r n o0 m,6
b iː0 r n eː0 v,6
b iː0 r n ɛ0 k,6
b iː0 r aː0 ʃ,5
b iː0 r aː0 ʃ t,6
b iː0 r aː0 k,5
b iː0 z n i0,5
b iː0 z n ɑ0 k,6
b iː0 z t ɑ0,5
b iː0 z o0 m,5
b iː0 z o0 tː,5
b iː0 z v ɑ0,5
b iː0 z i0,4
b iː0 z i0 k,5
b iː0 z i0 ʃ,5
b iː0 z u0 n k,6
b yː0 n ø0 ʃ,5
b yː0 n ø0 k,5
b yː0 n eː0 t,5
b yː0 n ɛ0,4
b yː0 n t ɛ0 tː,6
b yː0 n t ɛ0 k,6
b yː0 nː ɛ0 k,5
b yː0 v ø0 ʃ,5
b øː0 v ɛ0 n,5
b øː0 v ɛ0 bː,5
b øː0 v ɛ0 l,5
b øː0 v y0 l t,6
b øː0 v y0 l,5
b øː0 r ɛ0,4
b øː0 r yː0,4
b ɑ0 l r ɑ0,5
b ɑ0 l r oː0 l,6
b ɑ0 l g ɑ0,5
b ɑ0 l ɛ0 tː,5
b ɑ0 r aː0 t,5
b ɑ0 r aː0 ɲ,5
b ɑ0 r aː0 n,5
b ɑ0 r aː0 l t,6
b ɑ0 r aː0 ʒ,5
b ɑ0 r n ɑ0,5
b ɑ0 r n o0 k,6
b ɑ0 r l ɑ0 n g,7
b ɑ0 r l ɑ0 n d,7
b ɑ0 r l ɑ0 n t,7
b ɑ0 r ɑ0 d t,6
b ɑ0 r ɑ0 d,5
b ɑ0 r ɑ0 d s,6
b ɑ0 r ɑ0 d j,6
b ɑ0 r ɑ0 b,5
b ɑ0 r ɑ0 ɲ,5
b ɑ0 r ɑ0 n,5
b ɑ0 r ɑ0 n tʃ,6
b ɑ0 r ɑ0 s t,6
b ɑ0 r ɑ0 ts k,6
b ɑ0 r ɑ0 g,5
b ɑ0 r ɑ0 t,5
b ɑ0 r b aː0 r,6
b ɑ0 r b ɑ0 n,6
b ɑ0 r o0 m,5
b ɑ0 r o0 k,5
b ɑ0 j ɑ0,4
b ɑ0 j ɑ0 t,5
b ɑ0 j o0 n,5
b ɑ0 j o0 m,5
b ɑ0 j o0 k,5
b ɑ0 j o0 l t,6
b ɑ0 j o0 ʃ,5
b ɑ0 j n o0 ʃ,6
b ɑ0 j n o0 k,6
b ɑ0 j n ɑ0 l,6
b ɑ0 j n ɑ0,5
b ɑ0 j b ɑ0,5
b ɑ0 j b ɑ0 n,6
b ɑ0 j u0 k,5
b ɑ0 b ɑ0 d,5
b ɑ0 b ɑ0,4
b ɑ0 b aː0 j,5
b ɑ0 b aː0 j t,6
b ɑ0 b aː0 r,5
b ɑ0 b aː0 t,5
b ɑ0 n k o0 t,6
b ɑ0 n k o0 k,6
b ɑ0 n k aː0 r,6
b ɑ0 n k ø0 ɲ v,7
b ɑ0 n d ɑ0 r d,7
b ɑ0 n d ɑ0,5
b ɑ0 n d o0 n,6
b ɑ0 n aː0 r,5
b ɑ0 n aː0 tʃ,5
b ɑ0 n aː0 n t,6
b ɑ0 n aː0 l t,6
b ɑ0 n aː0 l,5
b ɑ0 n aː0 l d,6
b ɑ0 n aː0 l s,6
b ɑ0 n aː0 l j,6
b ɑ0 n aː0,4
b ɑ0 z aː0 n k,6
b ɑ0 z aː0 n,5
b ɑ0 z aː0 r,5
b ɑ0 sː u0 ʃ,5
b ɑ0 g o0 k,5
b ɑ0 g o0 t,5
b ɑ0 g o0 j,5
b y0 s k ɛ0,5
b y0 s k eː0 n,6
b y0 s k eː0 k,6
b y0 d ø0 ʃ,5
b u0 l i0,4
b u0 t ɑ0 t,5
b u0 t ɑ0 l,5
b u0 t ɑ0 l t,6
b u0 t ɑ0 k,5
b u0 t ɑ0 ʃ,5
b u0 t ɑ0 ʃ d,6
b u0 t ɑ0,4
b u0 t ɑ0 m,5
b u0 z i0,4
b u0 z i0 k,5
b u0 z g oː0,5
b u0 z g oː0 n,6
b u0 z d iː0 t,6
b u0 n k ɑ0,5
b u0 n k aː0 t,6
b u0 n k aː0 k,6
b u0 n k aː0 ʃ,6
b u0 n k aː0 m,6
b u0 n k oː0,5
b u0 s o0 k,5
b u0 s o0 n,5
b u0 s r ɑ0,5
b u0 k o0 r,5
b u0 k o0 tː,5
b u0 k aː0 ʃ,5
b u0 kː ɑ0 n t,6
b u0 kː ɑ0 n,5
b u0 r k o0 l t,7
b u0 sː ɑ0 l,5
b ø0 l tʃ ɛ0 k,6
b ø0 l tʃ ɛ0 n,6
b ø0 l tʃ ɛ0 bː,6
b ø0 l tʃ ø0 n,6
b ø0 r t eː0 n t,7
b ø0 r t ɛ0,5
b ø0 r t ø0 n,6
b ø0 r t ø0 n t,7
b uː0 t o0 n,5
b uː0 t o0 r,5
b uː0 tʃ uː0 t,5
b uː0 tʃ uː0,4
b oː0 n u0 s,5
b l u0 ɛ0 ʃ,5
aː0 l t ɑ0 l,5
aː0 l t ɑ0 k,5
aː0 l t o0 tː,5
aː0 l t j ɑ0,5
aː0 l t oː0,4
aː0 l t aː0 ʃ,5
aː0 l t ʃ aː0 g,6
aː0 l o0 m,4
aː0 l m o0 k,5
aː0 l m o0 t,5
aː0 l m o0 m,5
aː0 l m o0 ʃ,5
aː0 l m ɑ0,4
aː0 l d o0 tː,5
aː0 l d aː0 ʃ,5
aː0 l d aː0 ʃ t,6
aː0 l d j ɑ0,5
aː0 l d j o0 n,6
aː0 l ɑ0 s,4
aː0 l ɑ0 s t,5
aː0 l ɑ0 s d,5
aː0 l ɑ0 m,4
aː0 l ɑ0,3
aː0 l ɑ0 d,4
aː0 l ɑ0 k,4
aː0 l ɑ0 r ts,5
aː0 lː ɑ0 m,4
aː0 lː ɑ0 t,4
aː0 lː ɑ0 l t,5
aː0 lː ɑ0 l,4
aː0 lː ɑ0,3
aː0 lː oː0,3
aː0 lː n ɑ0 k,5
aː0 lː n ɑ0,4
aː0 lː n i0,4
aː0 lː t ɑ0 k,5
aː0 lː t ɑ0 m,5
aː0 lː t u0 n k,6
aː0 lː aː0 ʃ,4
aː0 lː aː0 ʃ t,5
aː0 lː aː0 n,4
aː0 lː aː0 t,4
aː0 lː o0 k,4
aː0 lː o0 tː,4
aː0 lː u0 n k,5
aː0 lː v ɑ0,4
aː0 lː iː0 t,4
aː0 lː j o0 n,5
aː0 lː j ɑ0,4
aː0 lː j u0 n k,6
aː0 lː h ɑ0 t,5
aː0 r o0 m,4
aː0 r o0 ʃ,4
aː0 r o0 ʃ t,5
aː0 r o0 n,4
aː0 r o0 k,4
aː0 r o0 l t,5
aː0 r ɑ0,3
aː0 r ɑ0 z,4
aː0 r ɑ0 k,4
aː0 r ɑ0 d t,5
aː0 r ɑ0 d,4
aː0 r ɑ0 t,4
aː0 r ɑ0 m,4
aː0 r ɑ0 n,4
aː0 r ɑ0 s t,5
aː0 r v iː0 z,5
aː0 r v ɑ0,4
aː0 r v aː0 ɲ,5
aː0 r v aː0 ɲ t,6
aː0 r aː0 n,4
aː0 r aː0 t,4
aː0 r aː0 ʃ,4
aː0 r aː0 ɲ,4
aː0 r aː0 ɲ t,5
aː0 r ɲ eː0 k,5
aː0 r ɲ ɑ0 ʃ,5
aː0 r ɲ ɑ0,4
aː0 r ɲ aː0 t,5
aː0 r u0 n k,5
aː0 r u0 l,4
aː0 r u0 l t,5
aː0 r u0,3
aː0 r u0 k,4
aː0 r t ɑ0 m,5
aː0 r t ɑ0,4
aː0 r t ɑ0 k,5
aː0 r t o0 k,5
aː0 r t o0 tː,5
aː0 r t o0 t,5
aː0 r t u0 n k,6
aː0 r t u0 k,5
aː0 r t aː0 k,5
aː0 r t aː0 ʃ,5
aː0 r t aː0 l,5
aː0 r t oː0,4
aː0 r t oː0 k,5
aː0 r t j ɑ0,5
aː0 r t n ɑ0 k,6
aː0 r t n aː0,5
aː0 r t n aː0 l,6
aː0 t l ɑ0 g,5
aː0 t m ɛ0 n t,6
aː0 t v aː0 ɲ,5
aː0 t v aː0 ɲ t,6
aː0 t v ɑ0,4
aː0 t v i0 tː,5
aː0 m d ɛ0,4
aː0 m b ɑ0 n,5
aː0 m b ɑ0,4
aː0 m b o0 r,5
aː0 m b o0 r t,6
aː0 m b aː0 r,5
aː0 b r ɑ0,4
aː0 b r aː0 t,5
aː0 g i0,3
aː0 g ɑ0,3
aː0 g ɑ0 ʃ,4
aː0 g ɑ0 bː,4
aː0 g ɑ0 k,4
aː0 ɟ b ɑ0 n,5
aː0 ɟ b ɑ0,4
aː0 ɟ b oː0 l,5
aː0 ɟ i0 k,4
aː0 ɟ i0,3
aː0 ɟ o0 tː,4
aː0 ɟ o0 m,4
aː0 ɟ o0 n,4
aː0 f ɑ0,3
aː0 p o0 l t,5
aː0 z o0 tː,4
uː0 j r ɑ0,4
uː0 j ɑ0 bː,4
uː0 j ɑ0 t,4
uː0 j ɑ0,3
uː0 j ɑ0 k,4
uː0 j ʃ aː0 g,5
uː0 j b oː0 l,5
uː0 j j aː0,4
uː0 j k o0 r,5
uː0 j f ɛ0 n t,6
uː0 j h o0 l d,6
uː0 j o0 ʃ,4
uː0 j o0 n ts,5
uː0 ɟ h o0 ɟ,5
uː0 ɟ i0 ʃ,4
uː0 ɟ ʃ ɛ0 m,5
uː0 ɟ m o0 n d,6
uː0 t o0 n,4
uː0 t o0 r,4
uː0 t j aː0 n,5
uː0 t j aː0 t,5
uː0 t j ɑ0,4
uː0 t r ɑ0,4
uː0 t r oː0 l,5
uː0 t n ɑ0 k,5
uː0 t i0,3
uː0 t b ɑ0 n,5
uː0 r n ɑ0 k,5
uː0 r h o0 z,5
uː0 r t oː0 l,5
uː0 r i0,3
uː0 rː ɑ0 l,4
uː0 rː aː0,3
uː0 tː ɛ0 ʃ t,5
uː0 s oː0,3
uː0 s i0 k,4
uː0 s n i0,4
f ɛ0 l eː0 g,5
f ɛ0 l eː0,4
f ɛ0 l eː0 t,5
f ɛ0 l eː0 m,5
f ɛ0 l eː0 r t,6
f ɛ0 l eː0 n k,6
f ɛ0 l eː0 n,5
f ɛ0 l eː0 p,5
f ɛ0 l ɛ0,4
f ɛ0 l ɛ0 n t,6
f ɛ0 l ɛ0 n,5
f ɛ0 l ɛ0 m,5
f ɛ0 l ɛ0 g,5
f ɛ0 l ɛ0 tː,5
f ɛ0 l ɛ0 d,5
f ɛ0 l ɛ0 k,5
f ɛ0 l ɛ0 l,5
f ɛ0 l ɛ0 l t,6
f ɛ0 l ɛ0 t,5
f ɛ0 l ɛ0 dː,5
f ɛ0 l ɛ0 j t ʃ d,8
f ɛ0 l ɛ0 ʃ,5
f ɛ0 l ɛ0 p,5
f ɛ0 l øː0 tː,5
f ɛ0 l øː0,4
f ɛ0 l øː0 bː,5
f ɛ0 l øː0 l,5
f ɛ0 l øː0 ɲ t,6
f ɛ0 l n ø0 k,6
f ɛ0 l n øː0 tː,6
f ɛ0 l n i0,5
f ɛ0 l n ɛ0 k,6
f ɛ0 l y0 l,5
f ɛ0 l y0 k,5
f ɛ0 l y0 n k,6
f ɛ0 l ʃ øː0,5
f ɛ0 l ʃ øː0 bː,6
f ɛ0 l ʃ øː0 k,6
f ɛ0 l ʃ øː0 t,6
f ɛ0 l aː0 lː t,6
f ɛ0 l aː0 lː,5
f ɛ0 l h u0 ɲ t,7
f ɛ0 l h øː0,5
f ɛ0 l h øː0 k,6
f ɛ0 l h øː0 ʃ,6
f ɛ0 l t yː0 n t,7
f ɛ0 l t ɛ0 tː,6
f ɛ0 l t ɛ0 l t,7
f ɛ0 l t ɛ0 m,6
f ɛ0 l t eː0 r,6
f ɛ0 l t i0,5
f ɛ0 l t øː0,5
f ɛ0 l j ɛ0 ʃ,6
f ɛ0 l j ɛ0 bː,6
f ɛ0 l j ø0 tː,6
f ɛ0 l j ø0 n,6
f ɛ0 l j u0 t,6
f ɛ0 l m uː0 l t,7
f ɛ0 l m ɛ0,5
f ɛ0 l m ɛ0 n t,7
f ɛ0 l m ɛ0 n ʃ,7
f ɛ0 l m ɛ0 ɟ,6
f ɛ0 l m ɛ0 z,6
f ɛ0 l m ɛ0 z t,7
f ɛ0 l m eː0 t,6
f ɛ0 l k i0,5
f ɛ0 l k ɛ0 ʃ,6
f ɛ0 l k ɛ0,5
f ɛ0 l k ɛ0 t,6
f ɛ0 l k ɛ0 m,6
f ɛ0 l k ɛ0 k,6
f ɛ0 l k ɛ0 z d,7
f ɛ0 l k ɛ0 n t,7
f ɛ0 l k ɛ0 l t,7
f ɛ0 l k eː0 s,6
f ɛ0 l k eː0 t,6
f ɛ0 l k y0 k,6
f ɛ0 l k yː0,5
f ɛ0 l v ɛ0 n ts,7
f ɛ0 l v ɛ0 n,6
f ɛ0 l v ɛ0 t,6
f ɛ0 l v ɛ0,5
f ɛ0 l v ɛ0 k,6
f ɛ0 l v ɛ0 tː,6
f ɛ0 l v yː0,5
f ɛ0 l v i0,5
f ɛ0 l v o0 n t,7
f ɛ0 l v eː0 t,6
f ɛ0 l v eː0 n,6
f ɛ0 l v t aː0 r ʃ,8
f ɛ0 l v b ɛ0 n,7
f ɛ0 l v b ɛ0,6
f ɛ0 l v r ɛ0,6
f ɛ0 l v aː0 r t,7
f ɛ0 l v aː0 r,6
f ɛ0 l v n ɛ0 k,7
f ɛ0 l s oː0,5
f ɛ0 l s aː0 n t,7
f ɛ0 l s iː0 n,6
f ɛ0 l s iː0 n t,7
f ɛ0 h eː0 z,5
f ɛ0 h eː0 r,5
f ɛ0 h eː0 n,5
f ɛ0 j eː0 t,5
f ɛ0 j eː0 n,5
f ɛ0 j eː0 r t,6
f ɛ0 j ɛ0 tː,5
f ɛ0 j ɛ0 k,5
f ɛ0 j ɛ0 n,5
f ɛ0 j ɛ0 t,5
f ɛ0 j ɛ0 ʃ,5
f ɛ0 j ɛ0,4
f ɛ0 j ɛ0 m,5
f ɛ0 j ɛ0 d,5
f ɛ0 j ɛ0 d t,6
f ɛ0 j j ɛ0 l,6
f ɛ0 j j ɛ0 bː,6
f ɛ0 j l i0 k,6
f ɛ0 j l øː0,5
f ɛ0 j l ɛ0 tː,6
f ɛ0 j l ɛ0 s,6
f ɛ0 j l ɛ0 s t,7
